userId, title, content, image, date
3,We need to transmit the bluetooth RSS firewall!,Vero sed omnis voluptatem animi. Magni nulla non dignissimos nihil et accusamus. Officia est optio exercitationem repellendus reiciendis. Non quia mollitia rerum iure fugiat consequuntur minus.,http://lorempixel.com/640/480/cats,Sat Jul 11 2020 08:45:34 GMT-0600 (Mountain Daylight Time)
6,You can't synthesize the program without bypassing the haptic RAM pixel!,Harum tempore et sequi mollitia minima vitae debitis. Qui necessitatibus odit laboriosam amet vitae repellendus. Totam quia exercitationem fugit velit. Blanditiis cum velit neque ea et voluptate earum iste.,http://lorempixel.com/640/480/food,Sat Jul 11 2020 06:48:32 GMT-0600 (Mountain Daylight Time)
6,Try to quantify the HDD monitor, maybe it will quantify the bluetooth bandwidth!,Qui voluptatum nesciunt ducimus nihil veritatis in voluptatem dolorem. Accusamus quia eveniet velit. Nihil minus explicabo et. Excepturi consequatur quos rerum quo. Qui eligendi alias ut voluptatem corporis voluptas omnis.,http://lorempixel.com/640/480/nightlife,Fri Jul 10 2020 20:14:53 GMT-0600 (Mountain Daylight Time)
2,The SDD firewall is down, navigate the wireless system so we can connect the XML microchip!,Accusantium cupiditate necessitatibus delectus et ullam non. Eius vel corporis. Quia modi et eos reprehenderit. Error fuga labore culpa voluptas eveniet nihil voluptatem.,http://lorempixel.com/640/480/abstract,Sat Jul 11 2020 06:45:50 GMT-0600 (Mountain Daylight Time)
3,You can't navigate the driver without transmitting the online GB port!,Est ut nulla expedita asperiores soluta numquam. Voluptatibus impedit earum aut at rerum. Quia autem minus molestiae odit ut vitae. Sapiente nesciunt cupiditate id.,http://lorempixel.com/640/480/abstract,Sat Jul 11 2020 09:59:23 GMT-0600 (Mountain Daylight Time)
6,copying the alarm won't do anything, we need to synthesize the wireless SMTP interface!,Ut adipisci quas ipsum. Vero error perferendis quasi. Eos eaque neque qui rerum distinctio. Hic recusandae sint optio sed repellat rerum.,http://lorempixel.com/640/480/transport,Sat Jul 11 2020 01:07:27 GMT-0600 (Mountain Daylight Time)
9,Use the mobile RSS capacitor, then you can index the cross-platform panel!,Perferendis quisquam et et ullam. Delectus qui expedita qui minima non. Laudantium quo assumenda non id neque. Architecto optio doloremque ea architecto. Quas aut dolorem velit aut eum ut repellendus. Optio rem dolorum vitae hic officiis quos molestiae vel.,http://lorempixel.com/640/480/transport,Fri Jul 10 2020 20:59:29 GMT-0600 (Mountain Daylight Time)
4,The THX card is down, generate the digital feed so we can connect the CSS circuit!,Et qui quo cupiditate est labore rem dolor inventore. Excepturi quos asperiores itaque consequuntur dolor aliquid soluta. Et natus nam non rerum sapiente. Fuga eveniet deleniti ea asperiores fugit ratione tenetur. Iure eum et minus. Eos qui est rerum qui atque ad quod asperiores.,http://lorempixel.com/640/480/technics,Sat Jul 11 2020 18:13:33 GMT-0600 (Mountain Daylight Time)
10,hacking the transmitter won't do anything, we need to synthesize the primary USB transmitter!,Officiis debitis hic non eum enim illo asperiores ullam. At provident a quia ut aut et rerum rerum. Tempora quibusdam ipsam asperiores dolorum commodi quia labore repudiandae. Officia beatae minima voluptatem ab unde. Vel non magni. Qui perferendis voluptatibus placeat deserunt consequuntur est quis adipisci et.,http://lorempixel.com/640/480/cats,Sat Jul 11 2020 13:00:20 GMT-0600 (Mountain Daylight Time)
7,The EXE feed is down, parse the online transmitter so we can index the AI pixel!,Ut veniam tempore sed unde. Enim qui dolores eos officia quidem quia quibusdam repellendus possimus. Et voluptates officiis dolore est et hic incidunt voluptate nemo.,http://lorempixel.com/640/480/sports,Sat Jul 11 2020 00:46:09 GMT-0600 (Mountain Daylight Time)
7,We need to synthesize the virtual PNG alarm!,Fugiat recusandae qui fugit beatae autem aliquid eos rerum. Eligendi voluptatibus omnis fuga animi et sint dolores. Quia laborum iure ea placeat ut libero. Est et laudantium minus labore.,http://lorempixel.com/640/480/city,Fri Jul 10 2020 20:33:30 GMT-0600 (Mountain Daylight Time)
9,You can't reboot the system without indexing the mobile JSON system!,Mollitia eos tempore est laboriosam. Occaecati eum aut laboriosam alias ex. Quae a sed ea minus laborum nisi. Veritatis expedita quaerat. Accusantium officia odit.,http://lorempixel.com/640/480/abstract,Sat Jul 11 2020 09:57:17 GMT-0600 (Mountain Daylight Time)
7,hacking the card won't do anything, we need to navigate the 1080p IB card!,Et nisi ut corporis distinctio ut sit. A ipsam doloremque iusto ut. Vel est excepturi quisquam rem temporibus dolores. Est est quod sit eius. Sit et occaecati iusto eligendi.,http://lorempixel.com/640/480/cats,Sat Jul 11 2020 09:01:41 GMT-0600 (Mountain Daylight Time)
6,Try to synthesize the XML bus, maybe it will compress the neural capacitor!,Ab amet vel quos. Facilis aut dolorum nihil. Velit nulla qui veritatis. Fugiat repellendus harum et sit non cum. A rerum magni.,http://lorempixel.com/640/480/animals,Sat Jul 11 2020 02:29:44 GMT-0600 (Mountain Daylight Time)
4,Try to calculate the SMTP monitor, maybe it will hack the cross-platform matrix!,Tenetur atque ullam quo quidem et et. Asperiores non aliquam minus veniam explicabo sed sequi et. Voluptas dolores ut doloremque. Totam dolor maiores perferendis est. Et ratione ex consequuntur quia dolores. Est optio nulla fugiat ipsa quia.,http://lorempixel.com/640/480/food,Fri Jul 10 2020 23:51:24 GMT-0600 (Mountain Daylight Time)
1,Use the bluetooth TCP pixel, then you can generate the primary microchip!,Non dolorem dolores aut cumque. Voluptatem assumenda ut quisquam impedit ab officiis. Reprehenderit quam rem quia culpa sapiente deleniti qui. Dolor rerum similique aliquam ut culpa corrupti.,http://lorempixel.com/640/480/abstract,Sat Jul 11 2020 04:58:17 GMT-0600 (Mountain Daylight Time)
2,Try to bypass the RAM bus, maybe it will transmit the solid state bus!,Delectus deleniti quod est. Nesciunt atque nobis et est et magnam qui cumque voluptatem. Odit molestias iste. Nam reprehenderit et error asperiores modi sequi unde doloremque ut.,http://lorempixel.com/640/480/abstract,Sat Jul 11 2020 04:55:52 GMT-0600 (Mountain Daylight Time)
10,Try to back up the USB program, maybe it will navigate the back-end application!,Nam assumenda omnis enim accusamus ipsum debitis ea. Corrupti inventore sed qui quis excepturi culpa ex sit voluptatem. Est voluptatem non. Tempora eveniet maxime aut.,http://lorempixel.com/640/480/abstract,Sat Jul 11 2020 04:21:17 GMT-0600 (Mountain Daylight Time)
3,If we index the interface, we can get to the XSS interface through the digital AGP array!,Doloremque mollitia quia ducimus facilis corrupti autem deserunt sequi. Ut aut atque. Libero aut in quis ullam.,http://lorempixel.com/640/480/city,Fri Jul 10 2020 18:59:05 GMT-0600 (Mountain Daylight Time)
10,Use the wireless IB monitor, then you can transmit the virtual driver!,Odit aspernatur suscipit. Amet aut culpa est expedita eaque soluta harum assumenda autem. Rerum est id aut et eveniet et. Aliquid autem est et at.,http://lorempixel.com/640/480/people,Sat Jul 11 2020 03:38:23 GMT-0600 (Mountain Daylight Time)
1,We need to quantify the multi-byte PNG interface!,Pariatur veritatis aliquid ullam sed animi. Et dignissimos qui. Et perferendis sunt cupiditate. Quod earum dolores et.,http://lorempixel.com/640/480/fashion,Sat Jul 11 2020 13:41:57 GMT-0600 (Mountain Daylight Time)
10,We need to navigate the multi-byte IB program!,Neque qui quas nulla repellat autem occaecati beatae. Sit ipsum voluptas et est ratione corrupti. Eos aut autem. Animi odit quo. Blanditiis commodi sequi cumque iure asperiores voluptas. In ut eum vitae ea.,http://lorempixel.com/640/480/cats,Sat Jul 11 2020 10:39:45 GMT-0600 (Mountain Daylight Time)
4,The SMTP system is down, override the optical microchip so we can override the JBOD driver!,Aut praesentium in. Qui animi dolor magni. Ut alias voluptatem enim amet recusandae voluptas incidunt animi tempora. Et molestias consequatur adipisci sed architecto aut nobis et qui. Eum ut ad itaque. Vitae repellat tenetur officiis quis.,http://lorempixel.com/640/480/sports,Sat Jul 11 2020 17:32:39 GMT-0600 (Mountain Daylight Time)
0,We need to quantify the auxiliary SMS pixel!,Consectetur repellendus fuga. Expedita repudiandae eum sint recusandae enim. Accusamus illum ea reprehenderit dolore cum in iure et.,http://lorempixel.com/640/480/city,Sat Jul 11 2020 16:06:01 GMT-0600 (Mountain Daylight Time)
2,You can't compress the transmitter without overriding the wireless GB bus!,Est esse aliquid tempora debitis placeat. Sit ipsum libero dignissimos modi sed non cupiditate adipisci. Dolores qui sit assumenda nesciunt sunt aut excepturi sapiente. Libero nostrum aut corrupti voluptatem quo. Aspernatur ut nihil itaque officiis magni laudantium illo. Nihil iure itaque aut optio.,http://lorempixel.com/640/480/fashion,Sat Jul 11 2020 13:27:53 GMT-0600 (Mountain Daylight Time)
6,We need to synthesize the cross-platform SMS protocol!,Quas ducimus ut aliquam ut facere laboriosam qui qui. Exercitationem aut rem harum nisi. Omnis expedita distinctio deleniti id. Dolores eos eius nesciunt ut ut est expedita eos. Sint saepe velit nihil eum. Ab similique repellendus esse expedita et ut eius sunt.,http://lorempixel.com/640/480/business,Sat Jul 11 2020 15:33:31 GMT-0600 (Mountain Daylight Time)
0,bypassing the driver won't do anything, we need to synthesize the primary SMTP transmitter!,Esse et suscipit et suscipit. Ut nesciunt ut magni delectus distinctio eos aliquam est facilis. Dolorem dolore autem est nulla est molestias aut. Odio aut repellat non ea repellendus et.,http://lorempixel.com/640/480/animals,Sat Jul 11 2020 06:05:31 GMT-0600 (Mountain Daylight Time)
1,compressing the transmitter won't do anything, we need to hack the online SMTP interface!,Ut neque fuga dolores et. Neque laborum ut. Odio perspiciatis tenetur vitae rerum. Aperiam ipsam explicabo sit tempora.,http://lorempixel.com/640/480/transport,Sat Jul 11 2020 10:30:09 GMT-0600 (Mountain Daylight Time)
3,overriding the hard drive won't do anything, we need to parse the mobile CSS protocol!,Eum exercitationem deserunt sunt perferendis. Rerum et minima asperiores delectus voluptas officiis ducimus. Tempore ut nesciunt necessitatibus nisi debitis ipsam est. Et magni quo soluta libero sed est blanditiis adipisci. Assumenda et rerum vel quam ut occaecati dolorem.,http://lorempixel.com/640/480/nature,Sat Jul 11 2020 17:51:18 GMT-0600 (Mountain Daylight Time)
5,overriding the card won't do anything, we need to generate the redundant SCSI matrix!,Aut placeat quia odio harum natus. Autem numquam error dolorem ad et voluptatum. Necessitatibus ea molestiae quibusdam ad ex reprehenderit nihil consequatur odit. Totam doloribus alias. Sed odit eveniet.,http://lorempixel.com/640/480/cats,Sat Jul 11 2020 11:42:39 GMT-0600 (Mountain Daylight Time)
3,If we hack the program, we can get to the GB capacitor through the online JSON port!,Fuga dolorum iusto modi possimus ullam rerum. Et accusamus adipisci. Consequuntur fugit voluptatibus occaecati. Et culpa placeat nesciunt asperiores aperiam exercitationem labore optio. Ratione ut fugit optio aliquid corporis et commodi qui. In porro sit earum.,http://lorempixel.com/640/480/city,Fri Jul 10 2020 20:12:36 GMT-0600 (Mountain Daylight Time)
6,Use the mobile AI system, then you can quantify the back-end port!,Expedita eum quae dignissimos animi id qui. Aperiam est saepe a ea. Ad fugiat tenetur nihil temporibus quod. Recusandae perferendis illo voluptas repellat quia repellat et dolores temporibus.,http://lorempixel.com/640/480/animals,Sat Jul 11 2020 00:43:11 GMT-0600 (Mountain Daylight Time)
0,programming the port won't do anything, we need to calculate the primary AI circuit!,Cum soluta totam quibusdam culpa suscipit voluptatum labore. Vitae rerum mollitia et facere. Accusantium ut voluptatem molestiae expedita facilis ad provident consequatur.,http://lorempixel.com/640/480/abstract,Sat Jul 11 2020 01:55:02 GMT-0600 (Mountain Daylight Time)
8,Use the solid state FTP program, then you can reboot the cross-platform microchip!,Consequatur neque et aut beatae ex. Placeat et ea iusto in iste dolorem. Natus expedita amet nihil.,http://lorempixel.com/640/480/sports,Sat Jul 11 2020 13:07:16 GMT-0600 (Mountain Daylight Time)
6,If we connect the feed, we can get to the SMS driver through the digital SCSI microchip!,Quo placeat quod. Totam atque nobis. Molestias earum voluptatem ipsa blanditiis qui quia.,http://lorempixel.com/640/480/cats,Sat Jul 11 2020 11:44:01 GMT-0600 (Mountain Daylight Time)
9,We need to bypass the haptic PCI program!,Fuga sint quibusdam rem asperiores praesentium. Excepturi ducimus id omnis ducimus ipsum. Quia et accusamus ut. Eligendi voluptatibus unde quia. Voluptatem nihil sed nihil fugit. Nam est sit autem cumque.,http://lorempixel.com/640/480/cats,Sat Jul 11 2020 05:41:50 GMT-0600 (Mountain Daylight Time)
3,We need to input the mobile FTP sensor!,Qui occaecati architecto veritatis consequatur error rerum consequatur nesciunt. Et est illo fugiat molestiae. Quo atque ratione qui blanditiis atque non et unde. Dolore quo earum laudantium consectetur et officia error consectetur laborum.,http://lorempixel.com/640/480/transport,Sat Jul 11 2020 14:12:53 GMT-0600 (Mountain Daylight Time)
1,I'll bypass the mobile EXE protocol, that should matrix the CSS alarm!,Dicta voluptatem eum libero sed voluptatibus quae sequi. Occaecati eveniet culpa et qui enim non iure labore soluta. Perferendis officiis officiis odio ipsa.,http://lorempixel.com/640/480/food,Sat Jul 11 2020 15:02:24 GMT-0600 (Mountain Daylight Time)
8,The USB alarm is down, quantify the bluetooth alarm so we can back up the SAS pixel!,Tempore qui distinctio et doloribus voluptatem. Dolores quod temporibus vero quia voluptatem alias qui voluptatem. Consequatur sit eos repellendus eum.,http://lorempixel.com/640/480/food,Fri Jul 10 2020 23:18:00 GMT-0600 (Mountain Daylight Time)
4,Try to program the SQL hard drive, maybe it will compress the mobile panel!,Consequuntur ullam ratione iusto ratione explicabo eos. Mollitia quia velit laudantium quia dolorem. Quia in perferendis vel doloribus et nihil. Laboriosam sit amet.,http://lorempixel.com/640/480/people,Sat Jul 11 2020 12:57:09 GMT-0600 (Mountain Daylight Time)
6,The AGP matrix is down, back up the wireless panel so we can override the SQL bandwidth!,Delectus ut sed explicabo sed occaecati possimus. Atque et ipsum officiis vel. Molestias beatae et voluptatum eaque perspiciatis. Cum dolorem qui nostrum aut cum commodi velit id. Laborum sit tempora at molestiae quibusdam.,http://lorempixel.com/640/480/city,Fri Jul 10 2020 18:42:30 GMT-0600 (Mountain Daylight Time)
7,We need to reboot the online RAM interface!,Dolorem non dolorem voluptas sint. Cumque libero corrupti veritatis dolores. Dolor minima voluptatem necessitatibus fuga est. Quos magnam numquam minus.,http://lorempixel.com/640/480/people,Sat Jul 11 2020 16:39:47 GMT-0600 (Mountain Daylight Time)
5,I'll parse the mobile XML firewall, that should hard drive the SDD application!,Repellat et in ad nobis animi. Mollitia et fugiat cumque temporibus. Consequatur ut aperiam sed quam nostrum. Omnis rerum ut eum autem qui nesciunt.,http://lorempixel.com/640/480/people,Sat Jul 11 2020 03:45:27 GMT-0600 (Mountain Daylight Time)
9,We need to back up the 1080p JSON array!,Maxime qui qui saepe itaque minima eos iste. Dolor quisquam velit et est autem et ea nihil illo. Iste minima sed error aut. Minus rerum et nemo corporis.,http://lorempixel.com/640/480/animals,Sat Jul 11 2020 06:16:46 GMT-0600 (Mountain Daylight Time)
10,You can't calculate the feed without overriding the wireless ADP capacitor!,Illum mollitia fugit consequatur eum excepturi incidunt quia. Id itaque et libero porro. Facilis consequatur facere deleniti assumenda voluptas ut ea ut. Consequuntur neque consequatur rerum velit sed velit. Molestias harum minus quod quaerat molestiae alias laboriosam. Omnis ad ut temporibus doloremque sit.,http://lorempixel.com/640/480/animals,Fri Jul 10 2020 21:13:52 GMT-0600 (Mountain Daylight Time)
3,I'll index the mobile SCSI system, that should protocol the JSON pixel!,Laudantium molestiae cumque maiores. Neque corporis ipsam cumque aut laborum sed omnis. Perspiciatis porro quisquam.,http://lorempixel.com/640/480/business,Sat Jul 11 2020 17:38:28 GMT-0600 (Mountain Daylight Time)
8,Use the mobile XSS feed, then you can bypass the neural microchip!,Iusto non quo aut dolores est mollitia. Dolor et dignissimos. Voluptas repellendus neque placeat magni tempora reprehenderit reprehenderit. Quasi et voluptates est earum aspernatur est nulla beatae. Atque cumque magnam nihil.,http://lorempixel.com/640/480/abstract,Sat Jul 11 2020 15:59:08 GMT-0600 (Mountain Daylight Time)
4,We need to navigate the haptic AI firewall!,Quod sed harum. Est suscipit commodi doloribus. At voluptatibus voluptates ut. Impedit dignissimos accusantium dolorum cumque et enim. Ut culpa mollitia ullam illum quibusdam distinctio quidem veritatis qui. Est ea error omnis quae quia et ducimus eum.,http://lorempixel.com/640/480/nightlife,Sat Jul 11 2020 17:25:39 GMT-0600 (Mountain Daylight Time)
10,If we synthesize the protocol, we can get to the SQL feed through the open-source CSS hard drive!,Blanditiis reiciendis doloribus itaque velit aliquam tenetur. Nesciunt aut sit mollitia quaerat placeat odio aut ut. Sunt est accusamus ut repellat. Est consectetur eum voluptatibus et aut voluptatem quos eius minus. Molestias ipsa et consequuntur qui placeat dolorem veritatis ea et.,http://lorempixel.com/640/480/animals,Sat Jul 11 2020 06:39:53 GMT-0600 (Mountain Daylight Time)
9,The SCSI matrix is down, navigate the wireless bandwidth so we can calculate the HTTP monitor!,Nostrum enim aut rerum ullam minima ut consequatur ad. Soluta perspiciatis enim sint esse cupiditate porro. Ab pariatur tempore qui fugiat. Et esse omnis qui quae iste odio quidem distinctio. Sit non qui autem aspernatur nihil dolores hic. Repudiandae inventore id quod.,http://lorempixel.com/640/480/food,Sat Jul 11 2020 11:14:17 GMT-0600 (Mountain Daylight Time)
4,I'll connect the bluetooth PCI microchip, that should matrix the SCSI protocol!,Molestiae iure eos reiciendis nihil debitis aut. Aspernatur minima atque ipsam. Qui ea quia est id culpa quod tenetur.,http://lorempixel.com/640/480/sports,Fri Jul 10 2020 19:23:42 GMT-0600 (Mountain Daylight Time)
7,You can't input the hard drive without generating the auxiliary SDD bandwidth!,Voluptas mollitia animi totam distinctio aut dolorem nihil quod. Vero delectus quam est amet. Dolorum illum dicta sint iste expedita delectus modi eum voluptas. Quo nemo fugiat qui inventore voluptate et rem. Nisi non et reprehenderit aliquid ullam a quidem.,http://lorempixel.com/640/480/transport,Sat Jul 11 2020 18:18:37 GMT-0600 (Mountain Daylight Time)
6,If we navigate the feed, we can get to the FTP card through the haptic COM protocol!,Rem minima sed. Ex in eum. Nobis ipsum saepe voluptatem. Necessitatibus est quos et. Reprehenderit dolor ducimus inventore est quos repellendus dolorum mollitia. Qui qui ab modi modi rerum.,http://lorempixel.com/640/480/abstract,Fri Jul 10 2020 23:54:26 GMT-0600 (Mountain Daylight Time)
8,You can't back up the application without navigating the 1080p SDD bandwidth!,Non animi nobis debitis. Voluptas minus quo voluptatem ex modi minus ut. Mollitia dolor laboriosam quam. Fugit et reprehenderit.,http://lorempixel.com/640/480/food,Sat Jul 11 2020 17:23:07 GMT-0600 (Mountain Daylight Time)
3,You can't index the circuit without hacking the haptic SMTP microchip!,Pariatur aliquam animi iure sit voluptatem placeat vel. Quas vitae eveniet saepe ullam rerum est et nobis blanditiis. Soluta voluptas veniam dolorem reprehenderit exercitationem quam.,http://lorempixel.com/640/480/animals,Sat Jul 11 2020 03:05:39 GMT-0600 (Mountain Daylight Time)
8,If we transmit the bandwidth, we can get to the SQL monitor through the optical SCSI firewall!,Sed doloremque eveniet sed adipisci. Qui incidunt velit sed. Sequi magni amet deserunt perferendis sint. Nesciunt totam dicta saepe ea ratione. Velit eos corrupti. Velit tempore earum nesciunt ducimus sit consequuntur explicabo.,http://lorempixel.com/640/480/sports,Sat Jul 11 2020 15:55:08 GMT-0600 (Mountain Daylight Time)
8,We need to program the optical JSON alarm!,Omnis magni eius architecto dignissimos. Quam saepe voluptatem deserunt. Esse sit eligendi dolore nisi qui. Ut asperiores distinctio. Impedit dolorum nostrum aut nihil aliquam. Consectetur voluptas nisi voluptatem.,http://lorempixel.com/640/480/abstract,Sat Jul 11 2020 01:39:05 GMT-0600 (Mountain Daylight Time)
2,If we override the circuit, we can get to the PCI card through the virtual AI hard drive!,Eligendi et et. Nisi ut velit. Tempora dignissimos rerum quo. Quae magni labore amet molestiae. Voluptatem earum qui cupiditate voluptatibus. Placeat molestiae rem hic amet soluta eligendi beatae quia quam.,http://lorempixel.com/640/480/cats,Sat Jul 11 2020 00:44:59 GMT-0600 (Mountain Daylight Time)
2,Try to navigate the HTTP monitor, maybe it will hack the multi-byte interface!,Voluptate harum voluptatem et eos ipsa ut. Nam qui ab consequatur quibusdam excepturi et exercitationem. Beatae repellat incidunt. Alias ullam voluptatem et quasi architecto harum delectus.,http://lorempixel.com/640/480/fashion,Sat Jul 11 2020 05:48:42 GMT-0600 (Mountain Daylight Time)
8,We need to back up the bluetooth SMS monitor!,Fugit itaque aut harum at aut. Aut eveniet reiciendis eaque. Voluptas omnis rem omnis esse ullam ex alias harum. Autem minima rerum esse voluptatum labore voluptatibus. Aliquid et quisquam corrupti accusantium recusandae minus et.,http://lorempixel.com/640/480/nature,Fri Jul 10 2020 22:44:23 GMT-0600 (Mountain Daylight Time)
9,You can't program the protocol without compressing the online PCI bandwidth!,Omnis quidem ab ipsa eius porro explicabo temporibus voluptas omnis. Quas cumque repellendus odit ipsum aut sed pariatur ea id. Et vero temporibus ut ut voluptatum necessitatibus. Non natus similique.,http://lorempixel.com/640/480/food,Sat Jul 11 2020 08:51:16 GMT-0600 (Mountain Daylight Time)
7,backing up the matrix won't do anything, we need to compress the wireless IB monitor!,Distinctio ducimus qui ut quas. Quia voluptate libero sequi quia. Delectus nisi rerum autem et non nostrum et laboriosam voluptatem. Quia nobis qui nihil itaque sed aliquam dicta. Sed occaecati repudiandae.,http://lorempixel.com/640/480/sports,Sat Jul 11 2020 07:14:10 GMT-0600 (Mountain Daylight Time)
6,Try to connect the SQL firewall, maybe it will quantify the haptic program!,Omnis accusantium facere. Provident est praesentium id dolore nostrum rerum eius illo. Itaque laboriosam impedit sint. Pariatur sit praesentium consequatur distinctio molestias.,http://lorempixel.com/640/480/sports,Sat Jul 11 2020 03:37:02 GMT-0600 (Mountain Daylight Time)
4,We need to parse the bluetooth SDD alarm!,Ut odio et omnis. Est voluptatem quia inventore. Voluptas sunt ut voluptas. Voluptate ea aut voluptatum optio consequatur in. Qui sint quam atque et et repudiandae animi minima.,http://lorempixel.com/640/480/abstract,Sat Jul 11 2020 08:53:29 GMT-0600 (Mountain Daylight Time)
2,You can't override the bus without connecting the redundant GB circuit!,Labore odit mollitia maiores qui dolorem. Sed illo qui exercitationem dolorum quod aperiam numquam. Quia enim neque voluptates atque natus ut et a. Et dignissimos aut.,http://lorempixel.com/640/480/animals,Sat Jul 11 2020 11:18:33 GMT-0600 (Mountain Daylight Time)
5,Use the solid state CSS monitor, then you can override the mobile card!,Eum voluptatum in nihil nobis quo quis tempora fuga dolor. Similique enim velit. Cupiditate dolorem voluptatem minus repudiandae. Unde non repellat est non. Est sunt ut cumque numquam.,http://lorempixel.com/640/480/fashion,Fri Jul 10 2020 22:51:45 GMT-0600 (Mountain Daylight Time)
0,The THX panel is down, parse the 1080p port so we can generate the SAS capacitor!,Natus ad neque aspernatur cum qui. Cupiditate earum ut ipsa. Optio in eos. Incidunt sed quia deleniti.,http://lorempixel.com/640/480/business,Fri Jul 10 2020 21:53:10 GMT-0600 (Mountain Daylight Time)
10,We need to calculate the wireless RAM microchip!,Mollitia maxime velit aliquam repellat autem aut. Numquam quas provident adipisci. Dolorem alias aperiam ipsum aut. Corporis aut autem. Quia voluptatem similique. Magnam et distinctio fugit officiis.,http://lorempixel.com/640/480/city,Sat Jul 11 2020 00:49:35 GMT-0600 (Mountain Daylight Time)
3,Use the cross-platform ADP application, then you can compress the digital sensor!,Nihil ut perspiciatis perspiciatis culpa dolorem earum officia deserunt. Dolorum voluptas nostrum voluptas id. Et et id ut voluptas et. At et assumenda et voluptates velit quam necessitatibus.,http://lorempixel.com/640/480/animals,Sat Jul 11 2020 05:38:37 GMT-0600 (Mountain Daylight Time)
4,Use the solid state ADP port, then you can index the mobile port!,Ut quisquam quibusdam quia aperiam ipsum. Tenetur rerum quia et id aut unde enim eveniet est. Architecto est sint repellendus corrupti vel facere pariatur deserunt. Et totam rem aut cum aperiam eius qui et assumenda. Nisi quae sit nostrum ducimus vel doloribus nam pariatur. Nihil dolores eius explicabo dolores ipsa cumque.,http://lorempixel.com/640/480/nature,Fri Jul 10 2020 20:05:05 GMT-0600 (Mountain Daylight Time)
