1,The PNG circuit is down, back up the digital panel so we can parse the AI program!,Autem laborum a maxime porro impedit. Ut id et et quia voluptatem voluptas veritatis eligendi. Totam natus molestias. Earum enim quo enim voluptates illum dolores.,http://lorempixel.com/640/480/fashion,Fri Jul 10 2020 19:38:13 GMT-0600 (Mountain Daylight Time)
10,We need to synthesize the wireless PCI microchip!,Eum ipsa voluptatum sint. Excepturi iusto architecto amet omnis praesentium ducimus exercitationem odio. Non error dolor rerum nemo harum. Porro ad sapiente odit ut. Possimus incidunt odit alias enim blanditiis officia corrupti placeat. Beatae ut nam.,http://lorempixel.com/640/480/abstract,Sat Jul 11 2020 12:52:43 GMT-0600 (Mountain Daylight Time)
0,Try to override the AI sensor, maybe it will navigate the mobile circuit!,Facilis deserunt impedit aut voluptatem aperiam. Dolorem et voluptatem qui voluptates minus assumenda aliquam earum. Tenetur reprehenderit nihil dolorem ipsam. Nobis recusandae cupiditate similique. Excepturi repellendus velit reiciendis rem iure.,http://lorempixel.com/640/480/business,Sat Jul 11 2020 10:44:20 GMT-0600 (Mountain Daylight Time)
3,I'll copy the auxiliary IB program, that should bandwidth the RAM driver!,Quis nobis eius. Aut possimus rerum dolorem. Quas repellendus voluptatem exercitationem. Voluptatum voluptatem iste perferendis in in suscipit accusantium. Omnis ut accusamus nihil hic officiis. Corporis soluta temporibus minus modi officia dolor nemo.,http://lorempixel.com/640/480/fashion,Sat Jul 11 2020 15:02:11 GMT-0600 (Mountain Daylight Time)
8,I'll program the neural FTP interface, that should driver the SSL bus!,Rerum voluptas eos ipsam. Et harum voluptatem recusandae cumque molestiae asperiores commodi. Voluptas est consequatur autem dolor accusamus maxime eum. Architecto commodi mollitia tempora magni.,http://lorempixel.com/640/480/fashion,Sat Jul 11 2020 03:37:51 GMT-0600 (Mountain Daylight Time)
5,programming the port won't do anything, we need to input the online EXE bandwidth!,Consequuntur molestiae quis porro eveniet. Laboriosam praesentium veritatis at eaque nemo. Unde expedita ut beatae accusantium. Nobis et quia. Voluptas molestiae ullam. Incidunt quae aliquid nisi.,http://lorempixel.com/640/480/transport,Sat Jul 11 2020 08:25:11 GMT-0600 (Mountain Daylight Time)
1,Try to copy the USB feed, maybe it will back up the haptic firewall!,Esse hic perferendis ad recusandae possimus est est. Nihil pariatur qui. Sequi deleniti ut eos eos ad vero itaque praesentium neque. Quisquam est perferendis ut esse blanditiis. Sint quos unde reiciendis nihil veniam repudiandae ut. Dicta deleniti ut dolores velit minus non culpa architecto.,http://lorempixel.com/640/480/city,Fri Jul 10 2020 19:20:23 GMT-0600 (Mountain Daylight Time)
9,Use the digital PNG protocol, then you can transmit the bluetooth feed!,Quisquam quam rem repellat. Voluptates commodi consequatur omnis ratione fuga eum vero. Quae molestiae veritatis est omnis quo praesentium distinctio asperiores. Cupiditate rerum vel dolor quos.,http://lorempixel.com/640/480/nightlife,Sat Jul 11 2020 01:34:53 GMT-0600 (Mountain Daylight Time)
1,We need to generate the back-end HTTP system!,Voluptatem ducimus et qui. Perspiciatis ut necessitatibus vitae dignissimos delectus. Ut magnam assumenda non adipisci. Aut ipsum nulla at quos. Recusandae aut sunt unde eveniet ad eligendi et.,http://lorempixel.com/640/480/nightlife,Sat Jul 11 2020 16:38:01 GMT-0600 (Mountain Daylight Time)
8,The AI sensor is down, generate the cross-platform program so we can program the XML port!,Vitae doloremque dignissimos rerum est nobis voluptates sed amet. Rerum cumque est ipsum illum veritatis animi quam. Eos dolore velit saepe eius sint possimus beatae rem hic. Qui illum officia maiores rerum commodi repellat.,http://lorempixel.com/640/480/transport,Fri Jul 10 2020 19:24:53 GMT-0600 (Mountain Daylight Time)
8,Use the bluetooth FTP panel, then you can generate the virtual bandwidth!,Totam aut reprehenderit accusantium sunt ipsam aspernatur neque. Maxime omnis ut perferendis nobis facilis debitis totam quibusdam et. Quas veniam enim et aut eligendi mollitia eveniet. Aut dicta at quia minus quis quas delectus. Sit fuga fuga doloribus aut quibusdam. Odit unde earum quas deleniti delectus vel.,http://lorempixel.com/640/480/animals,Sat Jul 11 2020 16:17:55 GMT-0600 (Mountain Daylight Time)
5,Use the wireless RAM feed, then you can bypass the auxiliary protocol!,Cupiditate reiciendis ea. Dignissimos fuga odio perferendis et. Corrupti placeat accusamus.,http://lorempixel.com/640/480/animals,Sat Jul 11 2020 01:56:02 GMT-0600 (Mountain Daylight Time)
3,Use the haptic SSL capacitor, then you can synthesize the cross-platform protocol!,Ab ut quidem a. Et dolor officiis aut nemo optio quo molestias sit. Aspernatur minima consequuntur optio aspernatur sunt voluptas natus ut. Dolorem impedit fugit nulla sint et et perspiciatis consectetur incidunt. Ut omnis suscipit laudantium qui.,http://lorempixel.com/640/480/sports,Sat Jul 11 2020 06:24:48 GMT-0600 (Mountain Daylight Time)
5,Use the bluetooth FTP monitor, then you can synthesize the virtual program!,Voluptatibus itaque quisquam in ducimus dolor incidunt. Qui dolor aut. Corporis molestias molestiae voluptates qui. Consequatur exercitationem et non natus aliquam molestias consectetur ipsa et. Quas iusto expedita est ipsum saepe placeat.,http://lorempixel.com/640/480/fashion,Sat Jul 11 2020 08:05:47 GMT-0600 (Mountain Daylight Time)
8,Try to bypass the EXE driver, maybe it will input the cross-platform monitor!,Inventore aliquam error alias aut nostrum. Quasi dolores impedit voluptas quia quaerat similique fuga sequi. Delectus voluptas quas doloremque et dolorem incidunt libero ut.,http://lorempixel.com/640/480/food,Sat Jul 11 2020 05:21:30 GMT-0600 (Mountain Daylight Time)
5,You can't override the alarm without calculating the open-source HDD protocol!,Maiores qui iste qui voluptas unde voluptates enim quis. Reiciendis quis itaque et soluta ut autem dolor. Deserunt officia dolores impedit blanditiis quia sint omnis ad explicabo. Assumenda possimus et eos eius debitis quam. Exercitationem assumenda quas exercitationem molestiae. Neque error ullam molestiae.,http://lorempixel.com/640/480/transport,Sat Jul 11 2020 10:20:19 GMT-0600 (Mountain Daylight Time)
9,I'll override the primary HTTP interface, that should alarm the JBOD circuit!,Temporibus et possimus reprehenderit quam laborum quasi commodi voluptas omnis. Fugiat laudantium neque non qui quasi quasi repellendus. Nobis voluptatem incidunt modi exercitationem. Consequatur et eos doloribus est.,http://lorempixel.com/640/480/business,Sat Jul 11 2020 11:29:38 GMT-0600 (Mountain Daylight Time)
2,compressing the monitor won't do anything, we need to override the cross-platform RAM protocol!,Eaque itaque maiores culpa et hic voluptatem et. Dicta a tempora et ipsa ratione. Beatae odit sint temporibus quas ipsa blanditiis.,http://lorempixel.com/640/480/nightlife,Sat Jul 11 2020 04:54:59 GMT-0600 (Mountain Daylight Time)
10,quantifying the bandwidth won't do anything, we need to hack the optical CSS pixel!,Eveniet fugiat sunt blanditiis quidem ut est. Libero et accusantium architecto et sit sunt. Alias quasi non ratione voluptatem voluptas doloremque adipisci mollitia ut. Eum error rerum nihil omnis error. Saepe quaerat animi totam magni natus quo veritatis libero. Repudiandae quia natus atque voluptatum autem.,http://lorempixel.com/640/480/sports,Sat Jul 11 2020 05:19:03 GMT-0600 (Mountain Daylight Time)
7,If we bypass the program, we can get to the AGP bandwidth through the 1080p CSS panel!,Dolor quo dicta libero. Nemo quas quis rem eum qui voluptatem. Provident ut ut. Temporibus eligendi dolores pariatur voluptatibus autem totam perferendis voluptas dolorem. Officia voluptate eum.,http://lorempixel.com/640/480/nature,Fri Jul 10 2020 18:53:27 GMT-0600 (Mountain Daylight Time)
4,transmitting the firewall won't do anything, we need to copy the redundant SMS bandwidth!,Et ut delectus dignissimos laboriosam rem architecto quod vel. Nihil occaecati est aliquam. Voluptate saepe consequatur consequatur rem molestiae. Voluptatum aut voluptas ea pariatur quod qui aliquam. Voluptates eaque a et blanditiis qui placeat beatae in reprehenderit.,http://lorempixel.com/640/480/animals,Fri Jul 10 2020 18:20:43 GMT-0600 (Mountain Daylight Time)
9,We need to input the optical HTTP circuit!,Pariatur aut ipsa dolores reiciendis. Adipisci libero laborum aut laborum odit qui. Deleniti exercitationem voluptas minima ut necessitatibus quidem aut et. Quia sed sequi quaerat ea optio nihil.,http://lorempixel.com/640/480/nature,Fri Jul 10 2020 19:48:30 GMT-0600 (Mountain Daylight Time)
3,We need to calculate the optical GB pixel!,Cupiditate voluptatem voluptatum inventore blanditiis consequatur et. Assumenda corporis totam quibusdam aut quae voluptatem dolorem. Unde rem quia aut omnis velit quod impedit. Neque blanditiis quibusdam voluptatem est voluptas quibusdam dolore. Ut veritatis molestias amet ut qui fugiat.,http://lorempixel.com/640/480/abstract,Fri Jul 10 2020 20:31:26 GMT-0600 (Mountain Daylight Time)
4,We need to reboot the open-source FTP system!,Nisi non reprehenderit ducimus voluptate aut maxime voluptatem unde amet. Ut sed ipsa accusantium enim ad. Omnis odio enim. Similique quam laborum hic veniam nam qui repellat. Numquam odio saepe temporibus perferendis voluptatem neque aut.,http://lorempixel.com/640/480/animals,Fri Jul 10 2020 20:22:49 GMT-0600 (Mountain Daylight Time)
10,We need to navigate the online SSL bus!,Dolorem ut qui reprehenderit. Optio ea autem itaque voluptates earum autem ipsum ratione perspiciatis. Officiis illum saepe occaecati. Cum sit voluptatem velit et.,http://lorempixel.com/640/480/people,Sat Jul 11 2020 05:57:15 GMT-0600 (Mountain Daylight Time)
7,quantifying the hard drive won't do anything, we need to parse the bluetooth IB matrix!,Magnam velit et hic veritatis culpa. Quo numquam minus beatae sapiente et vitae est est amet. Reiciendis quis explicabo qui ipsum minima. Consequatur nisi vel ab deleniti veniam architecto dicta voluptatum unde. Minima nam vero modi sequi aut ut delectus. Neque non officiis qui sunt dolorem quia voluptas blanditiis.,http://lorempixel.com/640/480/business,Sat Jul 11 2020 13:35:50 GMT-0600 (Mountain Daylight Time)
6,Try to input the AI hard drive, maybe it will index the primary driver!,Commodi atque alias inventore blanditiis nisi dignissimos aut. Maiores mollitia dolores facere et quae. Modi sunt fugit vitae distinctio vel et commodi fugiat.,http://lorempixel.com/640/480/cats,Sat Jul 11 2020 00:16:58 GMT-0600 (Mountain Daylight Time)
8,The AI card is down, input the 1080p application so we can program the AGP hard drive!,Suscipit tenetur eum sunt qui nemo illum. Iusto tenetur at. Maxime ut est magni amet. Minima dolor sequi consequuntur sint totam provident nulla. Est quaerat voluptatem sapiente velit.,http://lorempixel.com/640/480/abstract,Sat Jul 11 2020 11:45:26 GMT-0600 (Mountain Daylight Time)
8,Try to transmit the TCP sensor, maybe it will calculate the neural port!,Aliquam et eos molestias sit ducimus dolorum eveniet magnam. Occaecati earum voluptatibus quia consequuntur placeat qui. Hic expedita numquam iure neque qui et et sequi. Harum et ut ipsa occaecati nesciunt ratione aut. Sed et autem. Aut optio velit.,http://lorempixel.com/640/480/nature,Sat Jul 11 2020 17:34:42 GMT-0600 (Mountain Daylight Time)
2,If we calculate the alarm, we can get to the SDD capacitor through the haptic SDD alarm!,Et molestiae eligendi et et quisquam omnis. Itaque sed ea nisi. Culpa quibusdam eligendi accusantium sint porro saepe similique. Velit ut cumque magnam. Facilis assumenda qui. Optio ea ut reiciendis occaecati quis.,http://lorempixel.com/640/480/nightlife,Sat Jul 11 2020 08:18:09 GMT-0600 (Mountain Daylight Time)
8,Use the wireless HDD alarm, then you can copy the digital hard drive!,Adipisci dolorem voluptates et nobis et expedita ipsam accusantium. Illum dolorem enim. Ducimus laboriosam quo consectetur beatae suscipit beatae.,http://lorempixel.com/640/480/sports,Sat Jul 11 2020 02:17:21 GMT-0600 (Mountain Daylight Time)
3,The COM interface is down, quantify the digital card so we can navigate the XML port!,Culpa iste ipsam animi. Ut fuga adipisci labore aut aut accusamus ab eius cupiditate. Quo voluptatibus veniam distinctio voluptas est nihil minus nihil. Et voluptatem doloremque.,http://lorempixel.com/640/480/business,Sat Jul 11 2020 15:39:57 GMT-0600 (Mountain Daylight Time)
10,generating the interface won't do anything, we need to compress the online EXE microchip!,Ratione occaecati esse fugit distinctio voluptatum dolore vero. Labore necessitatibus excepturi quod. Quas dolor voluptatibus nihil odio. Magnam et aut.,http://lorempixel.com/640/480/nightlife,Sat Jul 11 2020 18:17:49 GMT-0600 (Mountain Daylight Time)
1,Try to compress the PCI monitor, maybe it will reboot the open-source driver!,Fugiat veniam ducimus et rerum suscipit cumque consequuntur voluptate. Tempora in beatae consequatur fugiat explicabo voluptate qui ut. Fuga enim aut sed in numquam omnis. In pariatur et pariatur harum.,http://lorempixel.com/640/480/animals,Sat Jul 11 2020 14:34:55 GMT-0600 (Mountain Daylight Time)
0,You can't input the panel without generating the auxiliary PNG firewall!,Et placeat ab non sapiente repellat sint dolore quo. Reprehenderit impedit ipsa. Voluptatibus et a. Iusto dolore labore et iure laborum ullam quae facilis ea. At id est. Eius sint pariatur ex dignissimos et repellat.,http://lorempixel.com/640/480/sports,Sat Jul 11 2020 17:19:16 GMT-0600 (Mountain Daylight Time)
8,Use the redundant HTTP bus, then you can input the redundant firewall!,Maiores ullam ex aut incidunt ut sint. Reprehenderit eveniet reiciendis vitae in. Ea earum quia culpa hic reiciendis inventore inventore consequatur sint. Atque impedit quam aut non voluptas eum quisquam quasi veniam.,http://lorempixel.com/640/480/people,Sat Jul 11 2020 16:18:00 GMT-0600 (Mountain Daylight Time)
1,The EXE panel is down, navigate the wireless monitor so we can input the XSS interface!,Dolorum qui saepe minus. Et autem consequatur. Voluptatem omnis ipsum quia enim id rerum et rerum blanditiis. Explicabo occaecati aperiam iusto. Fuga qui beatae quam fugiat qui ad vero consequatur.,http://lorempixel.com/640/480/nature,Sat Jul 11 2020 03:22:16 GMT-0600 (Mountain Daylight Time)
7,Try to quantify the ADP microchip, maybe it will parse the auxiliary program!,Nostrum cupiditate magni. Magni adipisci atque qui nihil odio modi. Repellendus voluptas ut non sit quasi non itaque praesentium.,http://lorempixel.com/640/480/abstract,Sat Jul 11 2020 13:44:20 GMT-0600 (Mountain Daylight Time)
2,If we reboot the circuit, we can get to the TCP protocol through the open-source SQL firewall!,Voluptatum quis suscipit et. Esse exercitationem quia soluta. Sed quia hic accusamus amet. Voluptatem debitis aut tempore sit aut sed.,http://lorempixel.com/640/480/people,Sat Jul 11 2020 00:14:40 GMT-0600 (Mountain Daylight Time)
6,If we connect the protocol, we can get to the XML array through the redundant SAS monitor!,Quis aut non et omnis dignissimos placeat quidem suscipit. Voluptatem ducimus sit. Ipsum illum repudiandae expedita omnis. Est non exercitationem ut illum quasi ipsum quidem sapiente.,http://lorempixel.com/640/480/cats,Sat Jul 11 2020 04:44:03 GMT-0600 (Mountain Daylight Time)
9,indexing the driver won't do anything, we need to reboot the redundant HDD feed!,Ipsum dolore sint vel error temporibus sit qui quis nihil. Asperiores quasi ea sit veritatis quia debitis non rem. Nisi et aliquid corporis suscipit. Quo autem dolor repudiandae unde at cum dolores unde. Possimus sapiente et voluptates odio. Iure ratione tempore soluta id explicabo.,http://lorempixel.com/640/480/sports,Sat Jul 11 2020 09:19:35 GMT-0600 (Mountain Daylight Time)
2,We need to transmit the digital IB transmitter!,Nam occaecati unde. Aliquam fuga reiciendis est earum ipsa atque rerum. Delectus velit laudantium. Ut quia ex voluptatum qui quos.,http://lorempixel.com/640/480/city,Sat Jul 11 2020 03:01:36 GMT-0600 (Mountain Daylight Time)
10,Try to quantify the AI driver, maybe it will navigate the solid state feed!,Temporibus autem laboriosam laborum officiis aspernatur. Sed vitae distinctio id qui. Voluptatem sunt doloribus. Veniam esse sit rem id sint sint. Est magni sequi aut ea molestiae quasi. Molestias molestiae quam quos.,http://lorempixel.com/640/480/technics,Sat Jul 11 2020 17:08:21 GMT-0600 (Mountain Daylight Time)
4,We need to input the solid state RSS bandwidth!,In qui eius qui repellendus cum fuga quasi est et. Et maiores nihil corrupti voluptatem est. Placeat quibusdam autem et officia. Temporibus possimus recusandae voluptatem nemo. Et et vel accusamus sint quibusdam.,http://lorempixel.com/640/480/people,Sat Jul 11 2020 01:01:31 GMT-0600 (Mountain Daylight Time)
7,We need to override the solid state SMTP microchip!,Quidem et eius. Aut consequatur consequatur ullam illum dolorem eveniet aperiam non assumenda. Natus tempore sed nihil id cumque suscipit. Eum omnis consequatur voluptas velit quia sint. Aperiam nihil ea.,http://lorempixel.com/640/480/nature,Fri Jul 10 2020 19:22:39 GMT-0600 (Mountain Daylight Time)
9,Try to copy the ADP capacitor, maybe it will copy the bluetooth array!,Ipsum reprehenderit sed iure aut voluptatem quia doloremque quia. Illum est similique exercitationem qui labore sapiente. Voluptatum et et nobis tenetur.,http://lorempixel.com/640/480/abstract,Sat Jul 11 2020 14:57:38 GMT-0600 (Mountain Daylight Time)
6,The TCP bus is down, input the mobile circuit so we can reboot the AI bus!,Dolorum itaque voluptas et illum unde. Ipsam eum beatae minima quia explicabo. Totam cum voluptatem est facilis et nobis totam. Praesentium saepe rerum blanditiis non id possimus.,http://lorempixel.com/640/480/abstract,Sat Jul 11 2020 12:03:33 GMT-0600 (Mountain Daylight Time)
2,We need to generate the primary EXE bandwidth!,Hic at dolor odit voluptatem et vel. Dignissimos aliquam quibusdam consequatur rerum id quia. Asperiores expedita sed possimus doloremque voluptas nesciunt aut voluptates. Cumque mollitia fugiat.,http://lorempixel.com/640/480/nature,Sat Jul 11 2020 12:39:28 GMT-0600 (Mountain Daylight Time)
9,Use the bluetooth AGP bus, then you can generate the back-end matrix!,Exercitationem perferendis aliquam. Sequi suscipit accusamus iure. Reprehenderit reiciendis nam ut deserunt perferendis. Quia eligendi animi nulla repudiandae ut. Est dolores autem dolores optio. Modi voluptas totam eligendi voluptas odio.,http://lorempixel.com/640/480/city,Sat Jul 11 2020 11:24:46 GMT-0600 (Mountain Daylight Time)
0,You can't copy the transmitter without navigating the auxiliary RSS driver!,Hic ratione hic voluptas rerum. Est fuga nihil dolore qui enim autem voluptatibus voluptas. Maxime unde unde praesentium dolorem.,http://lorempixel.com/640/480/abstract,Sat Jul 11 2020 07:41:01 GMT-0600 (Mountain Daylight Time)
10,You can't synthesize the alarm without transmitting the mobile SDD panel!,Quia mollitia est exercitationem. Aut voluptas nulla consequatur iste qui numquam corrupti illo. Vitae non repellendus dolorum ad fuga quia voluptate. Ut rerum maiores omnis enim harum.,http://lorempixel.com/640/480/city,Fri Jul 10 2020 22:42:52 GMT-0600 (Mountain Daylight Time)
5,You can't input the transmitter without programming the haptic TCP array!,Quis iure itaque sed. Recusandae qui fugit accusamus provident similique dolor distinctio. Repellendus possimus voluptatem id officia rem.,http://lorempixel.com/640/480/nightlife,Sat Jul 11 2020 10:20:36 GMT-0600 (Mountain Daylight Time)
5,The SCSI monitor is down, generate the cross-platform matrix so we can connect the HDD matrix!,Minima labore inventore rerum consequuntur est consequatur corrupti reiciendis sed. Officiis veritatis consequatur sit quasi. Nisi soluta et ipsum asperiores. Cupiditate ad molestiae. Qui nemo commodi neque. Aut fugiat labore ut est suscipit provident illo.,http://lorempixel.com/640/480/city,Sat Jul 11 2020 01:47:14 GMT-0600 (Mountain Daylight Time)
7,I'll reboot the back-end THX hard drive, that should application the PCI card!,Ratione ut hic ullam similique repellendus et. Sed et unde consequatur. Dicta quia at. Architecto delectus id hic harum aliquid rerum id autem cumque. Laborum magni dolor in ut occaecati reiciendis iste vero doloribus.,http://lorempixel.com/640/480/nature,Sat Jul 11 2020 16:48:33 GMT-0600 (Mountain Daylight Time)
0,Try to transmit the SQL system, maybe it will index the auxiliary port!,Itaque minus architecto ratione tempore quia sint sunt. Dolorem sunt illo. Enim perspiciatis et fuga eius sapiente facere odit qui sint. Delectus modi quis odit ut. Molestiae et asperiores dolor nesciunt deleniti voluptatem et et sint. Hic explicabo et.,http://lorempixel.com/640/480/cats,Sat Jul 11 2020 13:20:43 GMT-0600 (Mountain Daylight Time)
8,Use the cross-platform HTTP card, then you can back up the cross-platform protocol!,Officiis numquam ut non eos nulla aspernatur aliquid. Ex ea laboriosam in incidunt assumenda ad. Et et mollitia quod rerum aut fugit corporis.,http://lorempixel.com/640/480/technics,Sat Jul 11 2020 14:31:40 GMT-0600 (Mountain Daylight Time)
0,Try to input the SCSI transmitter, maybe it will quantify the multi-byte hard drive!,Suscipit nisi et. Doloribus dolorum expedita rerum. Reprehenderit qui iure maiores. Aut similique quia eum quas veniam doloremque impedit quia.,http://lorempixel.com/640/480/abstract,Sat Jul 11 2020 04:59:38 GMT-0600 (Mountain Daylight Time)
10,hacking the card won't do anything, we need to program the wireless SMS driver!,Veniam eaque molestias impedit cumque doloribus. A eos atque qui qui soluta. Sit quia nesciunt delectus voluptatum eligendi perferendis consectetur aperiam ipsum.,http://lorempixel.com/640/480/technics,Sat Jul 11 2020 01:22:25 GMT-0600 (Mountain Daylight Time)
4,You can't copy the microchip without overriding the open-source SSL interface!,Voluptate atque velit. Alias possimus eum vel magni maiores qui. Tempore quae maxime in aperiam non vero ut voluptas.,http://lorempixel.com/640/480/business,Sat Jul 11 2020 02:57:04 GMT-0600 (Mountain Daylight Time)
9,We need to copy the wireless JBOD system!,Repellat quasi odio quasi ea nostrum laboriosam corrupti vero. Accusamus aspernatur et facere temporibus. Eius sed eum velit repellat. Quasi nulla aut. At repellendus omnis dolor dolore.,http://lorempixel.com/640/480/transport,Sat Jul 11 2020 05:51:37 GMT-0600 (Mountain Daylight Time)
1,Try to navigate the XSS hard drive, maybe it will reboot the bluetooth system!,Accusamus perferendis et voluptas. Alias saepe autem sit ex molestiae voluptatum repudiandae ullam. Doloribus excepturi aliquid soluta non dolores.,http://lorempixel.com/640/480/animals,Sat Jul 11 2020 08:06:44 GMT-0600 (Mountain Daylight Time)
2,Try to navigate the SMS pixel, maybe it will compress the neural port!,Modi error occaecati voluptatem inventore quibusdam aliquam quaerat. Rem quis praesentium. Odit cumque sit autem nesciunt aut ullam sunt. Suscipit esse alias enim omnis quo. Excepturi nostrum enim facilis. Deleniti deserunt eligendi illum doloribus et sunt.,http://lorempixel.com/640/480/city,Sat Jul 11 2020 14:41:46 GMT-0600 (Mountain Daylight Time)
6,Try to index the JBOD array, maybe it will quantify the wireless protocol!,Et neque inventore itaque odio laudantium possimus recusandae. Eligendi et quae unde velit qui et aut aut. Et sint repudiandae expedita enim voluptatibus unde. Tenetur velit dignissimos deleniti provident vero rerum nesciunt.,http://lorempixel.com/640/480/city,Sat Jul 11 2020 14:38:57 GMT-0600 (Mountain Daylight Time)
3,You can't calculate the card without programming the digital CSS alarm!,Nostrum culpa sunt maiores quibusdam odit dolores dolorem reprehenderit. Impedit officia omnis eos. Quaerat non officiis quis. Et illo voluptatem numquam perferendis voluptas aliquid qui unde mollitia. Eum sapiente doloremque esse praesentium similique at animi cum. Voluptatem id voluptatem rerum eius fuga consequatur et.,http://lorempixel.com/640/480/nightlife,Fri Jul 10 2020 19:12:34 GMT-0600 (Mountain Daylight Time)
2,If we back up the capacitor, we can get to the SMS protocol through the haptic SDD matrix!,Dolorum explicabo quo vitae molestias est est id et aliquam. Nemo et sunt numquam quasi enim. Ut velit ab magni. Non fugit reprehenderit est. Ex nam exercitationem a fuga ut. Ut nisi enim necessitatibus.,http://lorempixel.com/640/480/abstract,Sat Jul 11 2020 01:02:32 GMT-0600 (Mountain Daylight Time)
6,I'll input the digital XSS sensor, that should alarm the JBOD card!,Consectetur excepturi eveniet culpa non. Quae et illo non fuga sed quidem quo consequatur ut. Qui ullam odio. Sed recusandae voluptatem. Dolore consequuntur et harum dolorem molestiae. Minus quis veritatis nulla velit.,http://lorempixel.com/640/480/animals,Sat Jul 11 2020 12:49:35 GMT-0600 (Mountain Daylight Time)
6,We need to bypass the digital COM microchip!,Commodi rem et temporibus. Exercitationem et necessitatibus. Dolorem iusto a sint error voluptatem tempore. Voluptas vitae sit voluptate quo. Quisquam deleniti a molestiae.,http://lorempixel.com/640/480/people,Sat Jul 11 2020 06:30:33 GMT-0600 (Mountain Daylight Time)
9,The COM bus is down, reboot the cross-platform interface so we can input the EXE alarm!,Cum rerum architecto consequuntur et delectus ipsa velit ullam. Omnis molestiae adipisci sint harum vel consequatur libero. Sequi et voluptas repellendus eum veritatis tempora nihil velit aperiam. Ut aliquid officiis dignissimos nobis sit ducimus.,http://lorempixel.com/640/480/city,Sat Jul 11 2020 15:22:47 GMT-0600 (Mountain Daylight Time)
