3,You can't copy the program without bypassing the neural JBOD application!,Expedita et eligendi blanditiis aut autem. Quia et quae ullam esse ea id molestiae sint. Excepturi nihil vero enim tenetur maiores minus illum nesciunt. Molestias aliquid accusantium quod est pariatur voluptate.,http://lorempixel.com/640/480/sports,Sat Jul 11 2020 13:33:46 GMT-0600 (Mountain Daylight Time)
4,You can't program the monitor without navigating the 1080p SAS circuit!,Dolorem non voluptatum molestias suscipit excepturi ut doloribus. Labore quia distinctio et nisi. Aspernatur et explicabo ut. Qui quos sunt. Magnam est voluptas est cupiditate provident fugit magnam.,http://lorempixel.com/640/480/abstract,Fri Jul 10 2020 18:29:37 GMT-0600 (Mountain Daylight Time)
1,I'll navigate the redundant SCSI firewall, that should system the XSS program!,Maxime ipsum repellendus velit suscipit quis facilis. Inventore aut cupiditate dolor natus placeat sit eius. Fugit possimus consequatur et minus neque eaque.,http://lorempixel.com/640/480/animals,Sat Jul 11 2020 01:53:55 GMT-0600 (Mountain Daylight Time)
2,Try to hack the HDD array, maybe it will override the optical application!,Quisquam eum tempore ipsam enim beatae labore. Aut excepturi iste velit facere non. Sed accusamus sed aperiam dicta ut ea accusantium qui. Atque dolores quaerat ut suscipit. Suscipit asperiores consequatur optio excepturi culpa aperiam.,http://lorempixel.com/640/480/technics,Fri Jul 10 2020 22:50:48 GMT-0600 (Mountain Daylight Time)
8,I'll calculate the back-end THX feed, that should feed the USB firewall!,Aut error cumque suscipit in voluptatibus ut. Enim iste veniam nisi quos. A est non rerum laboriosam voluptas.,http://lorempixel.com/640/480/food,Fri Jul 10 2020 20:30:00 GMT-0600 (Mountain Daylight Time)
8,Use the back-end SMS bandwidth, then you can reboot the open-source feed!,Inventore tenetur vel. Accusamus dolores tempora quaerat perspiciatis. Sit sequi molestias adipisci saepe vitae tenetur. Commodi voluptatem magnam ipsum. Ut libero qui in cumque. Qui et repellendus.,http://lorempixel.com/640/480/food,Sat Jul 11 2020 04:52:43 GMT-0600 (Mountain Daylight Time)
3,I'll parse the mobile FTP alarm, that should port the XSS firewall!,Aut qui et veniam quo. Porro doloribus enim quaerat qui dolorem est vel deserunt. Saepe quod esse. Sit autem est.,http://lorempixel.com/640/480/people,Sat Jul 11 2020 07:49:56 GMT-0600 (Mountain Daylight Time)
5,Try to synthesize the TCP panel, maybe it will override the primary port!,Quibusdam possimus eveniet. Consequatur eos non qui maiores aspernatur est cupiditate. Eius quis qui aperiam quis odit quaerat cumque saepe iste. Commodi dolores recusandae voluptas.,http://lorempixel.com/640/480/people,Sat Jul 11 2020 15:50:06 GMT-0600 (Mountain Daylight Time)
7,If we compress the microchip, we can get to the SQL pixel through the optical AGP application!,Eos officiis molestiae. Quam ducimus illo. Et quidem corporis asperiores beatae recusandae libero exercitationem iste. Quod id debitis aut est aliquid voluptatem qui eum omnis.,http://lorempixel.com/640/480/transport,Fri Jul 10 2020 20:28:03 GMT-0600 (Mountain Daylight Time)
5,If we parse the interface, we can get to the TCP interface through the virtual SAS card!,Sint deleniti tenetur voluptas. Minus aut sed delectus nihil perferendis eveniet sit. A ut necessitatibus pariatur recusandae repellendus culpa sit debitis reiciendis. Fugiat qui id ipsum iure. Nulla necessitatibus voluptas.,http://lorempixel.com/640/480/transport,Sat Jul 11 2020 03:47:50 GMT-0600 (Mountain Daylight Time)
5,You can't back up the driver without backing up the multi-byte SCSI bus!,Qui tempore nemo sequi. Porro dicta vel quam delectus asperiores et. Qui autem enim. Animi impedit sed nam dolorum. Explicabo et ratione quod.,http://lorempixel.com/640/480/sports,Sat Jul 11 2020 10:49:23 GMT-0600 (Mountain Daylight Time)
2,Try to back up the JBOD panel, maybe it will copy the optical alarm!,Pariatur voluptas ullam itaque odio et quod. Iure sunt quis modi est quae. Quae reiciendis provident quidem cupiditate quidem cumque voluptatem occaecati. Voluptas asperiores quia repellat quisquam.,http://lorempixel.com/640/480/abstract,Sat Jul 11 2020 15:55:45 GMT-0600 (Mountain Daylight Time)
0,Use the mobile XML feed, then you can copy the wireless transmitter!,Consectetur officiis molestiae ducimus qui similique saepe eveniet autem porro. Delectus libero molestiae et blanditiis architecto quia. Et excepturi soluta nobis officia placeat exercitationem vel. A facilis omnis dolorem neque vero et aspernatur id. Qui aut dolores blanditiis accusamus. Velit veritatis voluptatem omnis nulla esse non repellendus amet.,http://lorempixel.com/640/480/food,Sat Jul 11 2020 17:51:00 GMT-0600 (Mountain Daylight Time)
4,synthesizing the interface won't do anything, we need to input the solid state SSL protocol!,Qui tenetur explicabo nostrum. Omnis expedita et. Necessitatibus non nobis consequatur provident perferendis debitis sunt adipisci et. Consectetur voluptatem blanditiis explicabo similique dicta deserunt unde perferendis fuga. Repellendus dolor animi quos error dicta et eaque magni.,http://lorempixel.com/640/480/fashion,Sat Jul 11 2020 15:58:31 GMT-0600 (Mountain Daylight Time)
7,The XML bandwidth is down, index the wireless driver so we can compress the AGP card!,Voluptas adipisci eaque illum. Consequuntur dolorum iste odio. Doloremque quibusdam quis perspiciatis rem placeat consequatur assumenda ducimus laborum. Corrupti odit mollitia quibusdam cupiditate dolorum ut ut velit. Vel pariatur ex recusandae porro.,http://lorempixel.com/640/480/sports,Fri Jul 10 2020 20:32:36 GMT-0600 (Mountain Daylight Time)
9,You can't override the matrix without navigating the neural PNG application!,Et nemo ex officia non. Sequi accusantium minus. Ut ipsa vitae dolor officia eveniet earum quo nemo.,http://lorempixel.com/640/480/nightlife,Fri Jul 10 2020 23:27:42 GMT-0600 (Mountain Daylight Time)
8,Use the bluetooth CSS sensor, then you can index the digital capacitor!,Molestias molestias est rerum. Voluptas est nemo perspiciatis velit. Temporibus error molestias ratione quia a corporis facilis sit. Quibusdam provident doloremque ipsum. Consequuntur ut est ipsam distinctio est quo.,http://lorempixel.com/640/480/people,Sat Jul 11 2020 12:20:20 GMT-0600 (Mountain Daylight Time)
10,I'll program the auxiliary JSON hard drive, that should pixel the GB program!,Reprehenderit qui nihil consectetur minima minus. Minus et blanditiis aut incidunt excepturi corrupti. Qui accusamus sed ex minus harum commodi id.,http://lorempixel.com/640/480/nightlife,Sat Jul 11 2020 04:56:31 GMT-0600 (Mountain Daylight Time)
0,Use the optical AI protocol, then you can copy the neural bus!,Quia sunt sit voluptatibus quaerat corporis. Maiores reiciendis non ut necessitatibus voluptates adipisci rerum voluptatem alias. Iste suscipit exercitationem laborum modi velit tempora quis. Sequi dolorem officiis ut. Dolor aperiam vel aut. Ea aut quia ducimus aut modi.,http://lorempixel.com/640/480/nightlife,Sat Jul 11 2020 02:37:04 GMT-0600 (Mountain Daylight Time)
4,If we quantify the transmitter, we can get to the EXE transmitter through the open-source SDD alarm!,Quia sed rem dolores error a. Tempora distinctio quaerat. Aperiam sed voluptate ad et quam. Alias voluptatem ullam fuga assumenda facere facilis. Laudantium nihil temporibus voluptate itaque perspiciatis laboriosam itaque sunt quia. Minima eius provident dolorem impedit voluptatem commodi dolorem.,http://lorempixel.com/640/480/sports,Sat Jul 11 2020 16:55:42 GMT-0600 (Mountain Daylight Time)
4,I'll generate the bluetooth SMTP monitor, that should capacitor the SQL port!,Saepe quod hic autem id dolores exercitationem. Rem labore quia veritatis occaecati voluptates quis perferendis. In in dignissimos laudantium. Aperiam maxime ut molestias voluptas voluptatem.,http://lorempixel.com/640/480/food,Sat Jul 11 2020 17:42:08 GMT-0600 (Mountain Daylight Time)
1,The HDD port is down, back up the auxiliary matrix so we can index the SDD transmitter!,Sit qui itaque est occaecati velit non. Incidunt hic reprehenderit sunt odio et est assumenda tempora. Nesciunt eius et repellendus culpa minus enim sed voluptatum in. Reiciendis sed a voluptas quo est. Sint enim soluta error unde deserunt. Harum exercitationem odio officiis.,http://lorempixel.com/640/480/food,Sat Jul 11 2020 07:36:02 GMT-0600 (Mountain Daylight Time)
10,Try to compress the XML driver, maybe it will navigate the redundant circuit!,Animi quasi aliquam qui. Accusamus nisi quis dolores. Ipsa cum quae deserunt sint rerum vitae quo incidunt. Sint quidem qui deleniti deserunt tempore accusamus. Aperiam explicabo aut amet est dolor voluptate iure nemo.,http://lorempixel.com/640/480/fashion,Sat Jul 11 2020 17:47:11 GMT-0600 (Mountain Daylight Time)
3,hacking the transmitter won't do anything, we need to synthesize the auxiliary SMTP transmitter!,Sit et dolore omnis delectus sunt qui sint ut. Maxime autem accusamus earum sunt. Voluptates aspernatur odit ratione autem iste. Id autem reprehenderit voluptas eum sed ducimus fugit suscipit. Dolorem inventore ratione possimus.,http://lorempixel.com/640/480/food,Sat Jul 11 2020 16:03:41 GMT-0600 (Mountain Daylight Time)
7,If we transmit the alarm, we can get to the COM protocol through the primary ADP card!,Alias accusamus perspiciatis consectetur omnis accusamus. Necessitatibus est cupiditate et expedita eum dolor. Veniam quos beatae quas totam aliquam esse aut dolores.,http://lorempixel.com/640/480/sports,Sat Jul 11 2020 00:23:53 GMT-0600 (Mountain Daylight Time)
5,We need to compress the open-source TCP matrix!,Nihil quibusdam voluptatem velit reiciendis. Totam saepe odio. Sed repellendus aut neque ea atque illo. Eius sed et. Quia eos dolorum aperiam quia quam ipsam impedit aut.,http://lorempixel.com/640/480/people,Sat Jul 11 2020 14:48:52 GMT-0600 (Mountain Daylight Time)
6,Use the online PNG bandwidth, then you can reboot the cross-platform port!,Repellat deserunt id tempore quia vel quo qui. Voluptas recusandae ad. Omnis nemo quia earum voluptatum et mollitia excepturi possimus aspernatur.,http://lorempixel.com/640/480/business,Sat Jul 11 2020 08:27:17 GMT-0600 (Mountain Daylight Time)
4,overriding the application won't do anything, we need to quantify the optical TCP bandwidth!,Laboriosam nostrum est. Labore est illum. Omnis sunt rerum praesentium accusamus aut dolorem ut. Sit aut ut id aut nihil.,http://lorempixel.com/640/480/food,Sat Jul 11 2020 10:25:10 GMT-0600 (Mountain Daylight Time)
7,We need to bypass the primary SCSI program!,Eveniet nihil repudiandae ipsam dolores et officiis et. Veritatis voluptas delectus. Debitis autem qui ratione.,http://lorempixel.com/640/480/technics,Sat Jul 11 2020 07:35:51 GMT-0600 (Mountain Daylight Time)
5,The USB firewall is down, generate the neural protocol so we can synthesize the THX bus!,Qui nobis mollitia. Ratione quo dolor corrupti. Qui officia sapiente voluptas occaecati quod ea at quo neque.,http://lorempixel.com/640/480/cats,Sat Jul 11 2020 09:44:24 GMT-0600 (Mountain Daylight Time)
6,You can't generate the bandwidth without programming the solid state SQL array!,Blanditiis in sunt incidunt. Nobis tempore consequatur neque eius error maiores. Nihil ex sit exercitationem labore quia numquam.,http://lorempixel.com/640/480/abstract,Sat Jul 11 2020 04:40:38 GMT-0600 (Mountain Daylight Time)
6,If we synthesize the alarm, we can get to the SMTP system through the online SMS alarm!,Neque delectus laudantium maiores dolorem ratione eum perferendis. Enim aut dolor ab sint. Odio et qui perferendis hic architecto et eos.,http://lorempixel.com/640/480/cats,Sat Jul 11 2020 17:10:53 GMT-0600 (Mountain Daylight Time)
4,Try to reboot the JSON feed, maybe it will index the haptic capacitor!,Omnis suscipit voluptas culpa qui. Ut quas et. Consequatur iste quibusdam in dolorum quia nulla. Consequatur natus facilis.,http://lorempixel.com/640/480/fashion,Fri Jul 10 2020 22:24:12 GMT-0600 (Mountain Daylight Time)
10,The USB transmitter is down, input the solid state alarm so we can hack the PCI hard drive!,Laudantium nobis officia. Esse quia et inventore quisquam. Earum voluptate et officia. Odio dolorem hic dicta eum quo. Repellat qui esse rem deserunt. Sunt et numquam temporibus cum necessitatibus sit dolor neque repellat.,http://lorempixel.com/640/480/sports,Sat Jul 11 2020 06:38:04 GMT-0600 (Mountain Daylight Time)
10,The JBOD pixel is down, override the primary bandwidth so we can transmit the EXE sensor!,Alias et est ex eligendi odit natus quos. Sint quia itaque dolor voluptas perferendis. Ad minus molestiae sint ipsum perferendis accusamus dicta. Doloremque doloribus sunt excepturi aut repellendus iure.,http://lorempixel.com/640/480/nature,Sat Jul 11 2020 03:24:39 GMT-0600 (Mountain Daylight Time)
8,Use the haptic SMS interface, then you can quantify the mobile pixel!,Voluptatibus quos corporis ipsum quis nostrum aut. Nostrum dolore odit aut optio voluptatem. Laboriosam consectetur animi voluptas neque omnis veniam. Ea magni nostrum. Et voluptas dolor asperiores ut enim.,http://lorempixel.com/640/480/transport,Fri Jul 10 2020 18:34:55 GMT-0600 (Mountain Daylight Time)
2,Use the 1080p ADP interface, then you can navigate the redundant circuit!,Itaque adipisci optio rerum consequatur aut. At quia repellat quidem. Est id et est. Dolorem nobis asperiores inventore aliquid in.,http://lorempixel.com/640/480/nature,Sat Jul 11 2020 09:16:00 GMT-0600 (Mountain Daylight Time)
4,If we input the sensor, we can get to the COM firewall through the auxiliary FTP driver!,Similique praesentium dolores iste qui et nostrum unde sed. Sint ut quas incidunt. Dignissimos sit dolorum ex reiciendis sit earum maxime. Libero ratione eum quaerat at repellendus quidem.,http://lorempixel.com/640/480/transport,Sat Jul 11 2020 02:05:15 GMT-0600 (Mountain Daylight Time)
6,quantifying the pixel won't do anything, we need to calculate the back-end FTP pixel!,Amet debitis id nulla repudiandae porro voluptatem ullam. Cumque aut reprehenderit inventore unde voluptates soluta. Similique minima voluptatem aut a aut similique placeat eos. Quia quia dolor quisquam quod amet labore saepe vel.,http://lorempixel.com/640/480/nature,Sat Jul 11 2020 15:22:40 GMT-0600 (Mountain Daylight Time)
5,We need to back up the virtual FTP capacitor!,Nisi adipisci ut quidem ut. Incidunt illo sed. Omnis sunt ipsam facere quo fuga consequuntur id sed. Temporibus libero occaecati non et velit voluptatem optio pariatur. Voluptatem quae et sed in architecto incidunt illo sint. Aliquid id magnam voluptatem eveniet saepe nobis.,http://lorempixel.com/640/480/city,Sat Jul 11 2020 02:34:43 GMT-0600 (Mountain Daylight Time)
2,You can't copy the circuit without indexing the auxiliary RSS capacitor!,Quae facere ullam. Excepturi magni est eius molestias expedita ipsam blanditiis et at. Quasi nemo dolorem explicabo sint.,http://lorempixel.com/640/480/transport,Fri Jul 10 2020 19:48:43 GMT-0600 (Mountain Daylight Time)
5,If we transmit the system, we can get to the THX pixel through the multi-byte SSL interface!,Dolorem quia aut. Perspiciatis eaque culpa earum dicta totam excepturi magni rerum. Dolor cum ut qui vel consequatur nam sit laudantium. Qui autem aliquam eius et. Reprehenderit veritatis a et. Minima qui aperiam excepturi.,http://lorempixel.com/640/480/sports,Sat Jul 11 2020 15:01:11 GMT-0600 (Mountain Daylight Time)
9,If we quantify the panel, we can get to the SQL system through the haptic JBOD hard drive!,Et culpa sint quibusdam exercitationem quas beatae et perspiciatis quasi. Libero exercitationem doloribus ut. Nihil eius corporis incidunt aliquid esse non unde et.,http://lorempixel.com/640/480/people,Sat Jul 11 2020 18:15:55 GMT-0600 (Mountain Daylight Time)
5,We need to index the bluetooth RSS hard drive!,Non asperiores nemo itaque et voluptas voluptates. At adipisci dolores ullam. Expedita nesciunt qui aliquam. Aliquam qui sit nostrum illum tempora.,http://lorempixel.com/640/480/technics,Sat Jul 11 2020 04:59:38 GMT-0600 (Mountain Daylight Time)
9,Try to index the PNG feed, maybe it will input the solid state firewall!,Dolor maxime quia culpa minus. Aut molestiae omnis in commodi nihil deleniti adipisci. Distinctio rerum temporibus vero rem dignissimos ut dolorum omnis. Dolores est dolor amet illum odit. Nesciunt quisquam qui ratione minus. Nobis deserunt sint quas porro ut.,http://lorempixel.com/640/480/fashion,Sat Jul 11 2020 16:42:38 GMT-0600 (Mountain Daylight Time)
3,The IB transmitter is down, override the haptic hard drive so we can input the HTTP matrix!,Eum voluptas est ut libero nemo. Libero nemo et occaecati saepe blanditiis recusandae sequi ullam corrupti. Assumenda vitae nihil molestias et asperiores numquam. Sunt et ut molestias. Architecto non doloribus et adipisci corrupti sed. Deserunt et architecto harum sapiente dolore et totam ut.,http://lorempixel.com/640/480/nightlife,Sat Jul 11 2020 14:16:38 GMT-0600 (Mountain Daylight Time)
5,We need to calculate the open-source SMTP panel!,In dolores id velit. Voluptas voluptatem soluta ut ea enim perspiciatis ut quae dolore. Enim aliquid quidem rem voluptatum molestias quia et voluptatem. Quia dolorem quo. Ratione eum totam et et sed quo quas ab.,http://lorempixel.com/640/480/fashion,Sat Jul 11 2020 02:12:46 GMT-0600 (Mountain Daylight Time)
4,copying the matrix won't do anything, we need to compress the cross-platform JSON panel!,Voluptatem totam temporibus autem et mollitia error error accusamus praesentium. Ut recusandae esse quisquam atque eum. Velit ut voluptates est cum. Beatae perspiciatis commodi cupiditate eos. Omnis autem officia omnis blanditiis corrupti earum voluptas deserunt incidunt.,http://lorempixel.com/640/480/nature,Sat Jul 11 2020 10:24:56 GMT-0600 (Mountain Daylight Time)
5,bypassing the feed won't do anything, we need to back up the bluetooth GB application!,Officia quas voluptate ut cupiditate occaecati dolor. Minus blanditiis velit enim. Porro nihil non illo debitis praesentium fuga. Deleniti a cum explicabo eos. Qui qui vero molestiae voluptas laudantium.,http://lorempixel.com/640/480/transport,Sat Jul 11 2020 16:55:28 GMT-0600 (Mountain Daylight Time)
2,The SMTP bandwidth is down, generate the virtual transmitter so we can navigate the PNG alarm!,Distinctio accusantium facere odio quibusdam rerum sit unde ratione. Sed soluta laborum saepe adipisci asperiores consectetur explicabo vel. Ullam ad deserunt dolor eos. Doloribus omnis qui voluptatem consequatur ut molestias fuga. Consectetur ad provident debitis.,http://lorempixel.com/640/480/transport,Sat Jul 11 2020 02:28:02 GMT-0600 (Mountain Daylight Time)
8,Use the wireless PCI matrix, then you can override the digital interface!,Sed fugiat aut sint et. Et modi aliquam suscipit molestias voluptatum. Suscipit quia quia inventore voluptates. Quam sit aut fugit nihil architecto soluta cum maxime atque. Omnis molestiae accusantium laudantium adipisci aspernatur.,http://lorempixel.com/640/480/business,Sat Jul 11 2020 15:07:10 GMT-0600 (Mountain Daylight Time)
2,Try to parse the HTTP interface, maybe it will calculate the solid state bandwidth!,Similique facere animi similique ipsum qui inventore dolorum voluptatibus libero. Quidem fugit molestiae eum aliquam aut esse. Vel omnis iusto repellendus cupiditate officiis animi magni ipsa. Et qui pariatur est omnis molestiae facere. Perspiciatis quia at magnam voluptas pariatur neque earum labore.,http://lorempixel.com/640/480/sports,Sat Jul 11 2020 07:05:41 GMT-0600 (Mountain Daylight Time)
0,You can't connect the interface without quantifying the multi-byte TCP bus!,Enim consequatur quae dicta. Praesentium dignissimos iure minima eius. Blanditiis optio est debitis dolorum occaecati non enim minus excepturi.,http://lorempixel.com/640/480/business,Fri Jul 10 2020 18:25:20 GMT-0600 (Mountain Daylight Time)
1,We need to generate the solid state PCI protocol!,Voluptatem aut voluptate porro molestias vel nihil commodi assumenda pariatur. Tempora totam qui fugiat facere quos nisi quasi. Ea asperiores consequatur et architecto deleniti ea itaque. Aut reprehenderit id pariatur rerum in quis voluptatem cupiditate. Et sint aliquam.,http://lorempixel.com/640/480/nightlife,Sat Jul 11 2020 04:13:38 GMT-0600 (Mountain Daylight Time)
7,The RAM driver is down, override the redundant bandwidth so we can reboot the SMTP microchip!,Laboriosam nobis ad autem non ea. Expedita sed aspernatur quasi numquam. Doloribus accusamus eos sit impedit molestias consequatur porro modi doloribus. Alias dolore quos iure aliquid tempora assumenda voluptatem velit.,http://lorempixel.com/640/480/technics,Sat Jul 11 2020 01:07:06 GMT-0600 (Mountain Daylight Time)
8,If we connect the sensor, we can get to the SDD alarm through the mobile FTP firewall!,Rerum sapiente rerum alias dicta iure officia voluptas. Nihil porro est facilis soluta rerum numquam. Quod cumque repudiandae consequatur soluta consectetur aspernatur dolorum. Rerum atque suscipit aut eveniet voluptatem. Est placeat aut odit sequi.,http://lorempixel.com/640/480/fashion,Fri Jul 10 2020 19:31:19 GMT-0600 (Mountain Daylight Time)
7,If we generate the alarm, we can get to the USB microchip through the wireless COM firewall!,Ut harum ut consequatur. In quod accusamus quibusdam doloremque maxime voluptates. Repudiandae ut maiores rem ut assumenda veritatis autem consequatur. Voluptatem neque consectetur nostrum incidunt earum. Sunt molestiae ad rerum ex sint libero laudantium corporis mollitia.,http://lorempixel.com/640/480/abstract,Fri Jul 10 2020 22:52:42 GMT-0600 (Mountain Daylight Time)
7,Use the open-source TCP interface, then you can back up the redundant port!,Numquam dicta possimus commodi dolores et. Ut aperiam doloremque. Quia excepturi ipsum sit suscipit facilis harum non hic veritatis. Ut cumque quam dicta harum. Doloribus ut iusto.,http://lorempixel.com/640/480/animals,Sat Jul 11 2020 11:35:20 GMT-0600 (Mountain Daylight Time)
7,We need to synthesize the bluetooth GB protocol!,Rem recusandae recusandae aut iure perspiciatis et quis. Saepe quaerat architecto quae at modi eius suscipit. Earum natus asperiores dolor expedita magnam omnis est ut. Nisi ex corporis voluptatibus dolor voluptate ex facilis. Iusto quia dolor.,http://lorempixel.com/640/480/nightlife,Sat Jul 11 2020 02:57:01 GMT-0600 (Mountain Daylight Time)
4,I'll compress the online AGP pixel, that should monitor the JSON feed!,Culpa veniam alias laudantium et omnis laudantium. Quae magni consequatur praesentium asperiores non deserunt rem. Dicta ab et aut corrupti dolorem.,http://lorempixel.com/640/480/nature,Sat Jul 11 2020 05:09:19 GMT-0600 (Mountain Daylight Time)
9,The SSL circuit is down, navigate the mobile hard drive so we can copy the RAM system!,Ipsa eos sint natus quidem quibusdam in. Magni et minus. Beatae dolores voluptatibus temporibus doloribus ut quidem non quibusdam corrupti. Ab officiis est commodi rerum a.,http://lorempixel.com/640/480/food,Sat Jul 11 2020 10:58:00 GMT-0600 (Mountain Daylight Time)
7,You can't override the bus without transmitting the redundant PNG array!,Magni et fuga repellat veritatis. Aliquam et dolore ea aliquam temporibus rerum veniam est pariatur. Quo harum deleniti. Non deserunt repellat nihil ex reprehenderit ad deleniti unde id. Non ullam quisquam ut suscipit dolorem. Voluptatem eveniet mollitia explicabo beatae quibusdam.,http://lorempixel.com/640/480/fashion,Sat Jul 11 2020 10:12:31 GMT-0600 (Mountain Daylight Time)
6,Try to index the CSS application, maybe it will generate the online hard drive!,Doloremque rerum alias id. Aliquam iusto nostrum. Et reprehenderit minima fugiat quaerat esse molestiae molestias. Quos minus velit veniam est. Qui assumenda rerum fugiat quo iure voluptatem.,http://lorempixel.com/640/480/cats,Fri Jul 10 2020 19:33:36 GMT-0600 (Mountain Daylight Time)
3,If we override the card, we can get to the JSON application through the cross-platform THX driver!,Non veritatis dolores odio rerum ad est nemo. Ut eum sed minima laboriosam esse ut. Accusantium earum sed.,http://lorempixel.com/640/480/fashion,Sat Jul 11 2020 15:59:49 GMT-0600 (Mountain Daylight Time)
8,The JSON port is down, index the online bandwidth so we can navigate the GB bandwidth!,Culpa velit sequi cumque itaque quaerat dolores ut. Laboriosam perspiciatis quos suscipit. Modi est consequatur. Temporibus praesentium occaecati enim porro minus veniam officia qui. Quia libero cum quia blanditiis eligendi.,http://lorempixel.com/640/480/animals,Fri Jul 10 2020 18:56:46 GMT-0600 (Mountain Daylight Time)
7,If we back up the program, we can get to the GB microchip through the mobile JBOD panel!,Quasi facilis est unde ullam quis necessitatibus. Incidunt voluptas consequatur dolorum nisi vitae molestiae repellat distinctio. Sed ea nihil eveniet reiciendis ratione. Harum repellendus mollitia ea modi. Aspernatur et placeat esse velit aut.,http://lorempixel.com/640/480/fashion,Sat Jul 11 2020 01:26:54 GMT-0600 (Mountain Daylight Time)
10,We need to transmit the multi-byte XSS firewall!,Id voluptatem sed nulla velit voluptatem. Qui consequatur aperiam aspernatur eum impedit. Praesentium et id vel id. Cupiditate dignissimos eveniet corporis ea aut suscipit. Qui voluptatem quidem et saepe alias voluptatem omnis. Perspiciatis nam molestiae optio.,http://lorempixel.com/640/480/cats,Sat Jul 11 2020 16:39:28 GMT-0600 (Mountain Daylight Time)
4,Try to override the AGP transmitter, maybe it will input the optical port!,Beatae numquam voluptas. Numquam voluptatum quibusdam neque at illum alias qui. Illo vel distinctio quod. Dicta libero quo debitis dolorem impedit quasi debitis. Omnis corrupti alias aspernatur saepe commodi. Temporibus et laborum necessitatibus amet quia ipsa ullam repudiandae.,http://lorempixel.com/640/480/food,Sat Jul 11 2020 09:57:23 GMT-0600 (Mountain Daylight Time)
