3,If we back up the feed, we can get to the ADP driver through the auxiliary USB circuit!,Harum tempora ratione delectus reiciendis. Rerum mollitia porro quia eius aut aperiam laborum eos voluptatem. Et cumque dolor minus. Velit doloribus maiores neque labore voluptatem et inventore ut eaque. Ducimus aut iure et ut consequatur ut architecto saepe id. Et ut eveniet rerum laborum.,http://lorempixel.com/640/480/food,Fri Jul 10 2020 19:25:33 GMT-0600 (Mountain Daylight Time)
8,The FTP program is down, quantify the virtual driver so we can parse the RAM circuit!,Aperiam dolorem alias et commodi occaecati quod sunt. Aspernatur quam voluptas ea vitae ad velit qui tempora. Iure dolorem aliquid eos eveniet velit voluptate fugiat aut a. Aut vel consequatur ipsum voluptates quia. Exercitationem eum ipsum. Alias praesentium nesciunt sunt eveniet dolores illo voluptatem nostrum.,http://lorempixel.com/640/480/people,Sat Jul 11 2020 00:30:01 GMT-0600 (Mountain Daylight Time)
7,We need to calculate the virtual SMTP capacitor!,Repudiandae temporibus et molestiae aut deserunt. Quis aut quos ducimus tenetur error et aut et modi. Facilis ullam et at assumenda et dignissimos facere. Dolore repellat placeat omnis quae iure dolorem rerum non quos. Non dolores molestiae. Maxime eos sed voluptatem est possimus praesentium doloremque.,http://lorempixel.com/640/480/abstract,Sat Jul 11 2020 12:14:00 GMT-0600 (Mountain Daylight Time)
9,copying the pixel won't do anything, we need to hack the wireless JBOD panel!,Ut totam qui ut recusandae hic molestiae. Sed non rerum et possimus reprehenderit voluptates delectus ut. Velit non illo officiis.,http://lorempixel.com/640/480/cats,Sat Jul 11 2020 17:13:41 GMT-0600 (Mountain Daylight Time)
9,I'll navigate the redundant PNG protocol, that should card the SMTP card!,Placeat at quia accusantium illo iste est expedita inventore. Vitae hic itaque vero excepturi ab quod minus quia. Necessitatibus assumenda ex rem eum praesentium assumenda in. Iste dolorem error. Ad vitae a quia doloremque.,http://lorempixel.com/640/480/nightlife,Fri Jul 10 2020 18:54:39 GMT-0600 (Mountain Daylight Time)
8,I'll transmit the redundant COM driver, that should pixel the EXE capacitor!,Repellat eum distinctio quam ea magni placeat aspernatur est. Est nobis provident eveniet quo in ratione et. Et ducimus odit. Voluptas nihil aspernatur quis eaque qui. In esse enim possimus nihil enim ad ipsa vel natus. Consectetur consequatur non veritatis qui cum voluptates numquam et tenetur.,http://lorempixel.com/640/480/people,Sat Jul 11 2020 18:04:37 GMT-0600 (Mountain Daylight Time)
2,Try to transmit the AGP matrix, maybe it will copy the mobile card!,Nostrum rem voluptatum quia. Nobis sequi ipsum fuga cupiditate. Expedita tenetur suscipit optio cumque quos saepe iure dolores.,http://lorempixel.com/640/480/food,Sat Jul 11 2020 07:53:38 GMT-0600 (Mountain Daylight Time)
8,Use the neural CSS interface, then you can transmit the 1080p array!,Deserunt et exercitationem sit qui atque quis et. Animi dicta consequuntur. Itaque autem aut cupiditate.,http://lorempixel.com/640/480/people,Sat Jul 11 2020 05:28:39 GMT-0600 (Mountain Daylight Time)
6,Try to transmit the THX system, maybe it will transmit the digital interface!,Nostrum et doloremque impedit necessitatibus. Eum qui saepe sapiente eos rerum ut voluptas est occaecati. Error debitis esse expedita quia sint corporis ut illum. Voluptatem ut quas non. Est ut labore eos.,http://lorempixel.com/640/480/transport,Fri Jul 10 2020 21:50:10 GMT-0600 (Mountain Daylight Time)
9,I'll connect the neural USB microchip, that should array the THX array!,Animi dicta corporis saepe reiciendis esse voluptas ut fugiat. Molestiae deserunt quia vel non voluptatibus reprehenderit. Rerum illum rem.,http://lorempixel.com/640/480/technics,Fri Jul 10 2020 18:49:09 GMT-0600 (Mountain Daylight Time)
2,If we override the protocol, we can get to the RAM feed through the virtual CSS firewall!,Natus dolor ut qui beatae. Voluptatem illo consequatur ipsa molestiae et. Vitae numquam excepturi nulla at necessitatibus earum corporis temporibus eum. Iste fugiat quasi vel voluptas sed ut laudantium voluptatibus laboriosam. Quod rem est iste ullam deleniti quis et.,http://lorempixel.com/640/480/cats,Sat Jul 11 2020 11:18:37 GMT-0600 (Mountain Daylight Time)
2,You can't index the driver without indexing the wireless RAM array!,Voluptatem nihil qui laboriosam. Praesentium inventore molestiae consequuntur atque qui illo fugit nihil. Eveniet officiis illum id accusamus quaerat eum delectus. Vitae minima iste labore aut.,http://lorempixel.com/640/480/nature,Sat Jul 11 2020 16:17:42 GMT-0600 (Mountain Daylight Time)
4,I'll navigate the bluetooth JSON system, that should capacitor the XML matrix!,Sint natus nisi. Qui autem sequi ex laboriosam deserunt dolores quae dolorem. Distinctio id eum vel qui aut.,http://lorempixel.com/640/480/fashion,Sat Jul 11 2020 16:05:24 GMT-0600 (Mountain Daylight Time)
0,We need to copy the bluetooth HDD matrix!,Repellendus et vel unde omnis repellendus dolores labore aut. Incidunt magni non est. Dolor ea harum et totam. Dolorum doloribus non.,http://lorempixel.com/640/480/animals,Sat Jul 11 2020 04:06:56 GMT-0600 (Mountain Daylight Time)
5,You can't quantify the bandwidth without navigating the redundant HDD firewall!,Est voluptas officia beatae ullam. Commodi omnis corporis. Ut totam aut quia. Veniam dolores officiis accusantium officia soluta eos sapiente. Ut quia hic aliquid quae et dolor alias.,http://lorempixel.com/640/480/abstract,Sat Jul 11 2020 11:11:16 GMT-0600 (Mountain Daylight Time)
4,Try to copy the IB firewall, maybe it will bypass the cross-platform card!,Qui rem aut laboriosam. Labore iste consequatur recusandae et tempore. Qui adipisci dolorem vitae laboriosam aliquid est eius.,http://lorempixel.com/640/480/sports,Fri Jul 10 2020 22:36:49 GMT-0600 (Mountain Daylight Time)
4,We need to navigate the digital SCSI bandwidth!,Eum est quia provident. Et perspiciatis maxime voluptate unde iure et incidunt cumque maxime. Quia ducimus aperiam. Eos qui corrupti est. Voluptate sit non corrupti non quidem qui.,http://lorempixel.com/640/480/sports,Fri Jul 10 2020 19:24:26 GMT-0600 (Mountain Daylight Time)
5,The AI port is down, quantify the auxiliary alarm so we can override the XSS microchip!,Accusantium qui exercitationem totam sed. Sapiente quae deserunt saepe dolorum porro. Assumenda cumque dolor officia quia dolor aspernatur ut ea. Blanditiis totam architecto magnam doloribus porro vel. Aspernatur iusto consequatur autem.,http://lorempixel.com/640/480/cats,Fri Jul 10 2020 19:06:57 GMT-0600 (Mountain Daylight Time)
7,I'll connect the 1080p COM transmitter, that should protocol the XSS monitor!,Voluptatibus ea quo minima illum tenetur. Quaerat pariatur voluptatem eum. Nemo dolorum illum. Commodi esse excepturi excepturi a. Unde quia rerum voluptas. Atque cupiditate quia quis repudiandae facere.,http://lorempixel.com/640/480/fashion,Fri Jul 10 2020 20:03:13 GMT-0600 (Mountain Daylight Time)
9,I'll hack the neural AGP port, that should card the EXE capacitor!,Architecto et corrupti reiciendis eveniet velit velit aliquid. Quo error modi corrupti nulla quo labore quia consectetur qui. Possimus nisi nulla unde minus ut.,http://lorempixel.com/640/480/abstract,Fri Jul 10 2020 22:49:11 GMT-0600 (Mountain Daylight Time)
7,I'll index the redundant TCP port, that should hard drive the PNG port!,Consequatur ut eligendi officia ipsam mollitia ut veniam recusandae doloremque. Est sint similique maxime autem nobis reiciendis. Voluptatem esse rerum non reiciendis. Aliquid cum sint aut sequi possimus est excepturi.,http://lorempixel.com/640/480/fashion,Sat Jul 11 2020 08:19:37 GMT-0600 (Mountain Daylight Time)
6,Use the bluetooth HTTP panel, then you can input the digital protocol!,Libero iste doloribus hic velit ut cum commodi iure inventore. Et amet quod quos voluptas aut. Veritatis dolore quia sit error fuga.,http://lorempixel.com/640/480/nightlife,Sat Jul 11 2020 01:49:40 GMT-0600 (Mountain Daylight Time)
5,I'll parse the bluetooth XSS bandwidth, that should panel the PCI sensor!,Nisi sed non repellendus est dolor ipsum dicta. Architecto eos animi rerum magnam. Eum eum voluptatem soluta aut. Inventore autem ullam modi accusantium eum molestiae.,http://lorempixel.com/640/480/business,Fri Jul 10 2020 22:24:09 GMT-0600 (Mountain Daylight Time)
1,The SQL port is down, program the wireless array so we can reboot the USB firewall!,Ipsa perspiciatis quia. Alias iure sapiente voluptatum aut voluptatem voluptas sunt. Consectetur cum qui.,http://lorempixel.com/640/480/food,Sat Jul 11 2020 03:09:48 GMT-0600 (Mountain Daylight Time)
3,Use the solid state RAM capacitor, then you can reboot the bluetooth protocol!,Quaerat consequuntur velit omnis rerum expedita ea. Molestias ut iste et. Consectetur voluptate aut officiis temporibus repellendus quos autem et expedita. Qui voluptatem quia illo saepe quae reiciendis ipsa.,http://lorempixel.com/640/480/sports,Sat Jul 11 2020 09:12:16 GMT-0600 (Mountain Daylight Time)
2,We need to quantify the multi-byte JSON matrix!,Dolore nihil voluptatem voluptas impedit voluptas perspiciatis reprehenderit eligendi id. Exercitationem eos placeat voluptas id incidunt perferendis. Et ex et.,http://lorempixel.com/640/480/city,Sat Jul 11 2020 15:39:34 GMT-0600 (Mountain Daylight Time)
0,If we index the program, we can get to the TCP bus through the 1080p XSS interface!,Modi in officia odio ipsum doloremque in necessitatibus non. Sint quasi sint molestiae minima. Velit perferendis reprehenderit adipisci odit quaerat optio omnis similique nam.,http://lorempixel.com/640/480/abstract,Sat Jul 11 2020 14:32:12 GMT-0600 (Mountain Daylight Time)
6,synthesizing the feed won't do anything, we need to back up the digital XSS hard drive!,Velit et blanditiis ut aperiam. Eum dolorum et voluptatem voluptates omnis. Earum vero quidem iste excepturi unde hic totam.,http://lorempixel.com/640/480/business,Sat Jul 11 2020 01:21:18 GMT-0600 (Mountain Daylight Time)
4,We need to index the mobile FTP interface!,Quibusdam delectus optio maxime. Ea nihil sed rerum est voluptatem quia. Dolorem beatae veniam voluptas optio quae nam. Voluptatem eum suscipit delectus. Laboriosam velit molestiae corporis ut et. Totam autem commodi velit eius est ab aut commodi.,http://lorempixel.com/640/480/food,Sat Jul 11 2020 17:34:02 GMT-0600 (Mountain Daylight Time)
4,I'll copy the auxiliary COM monitor, that should firewall the HTTP monitor!,Quidem eos dolorem iure quia qui. Temporibus et qui quos voluptatem maxime. Inventore reiciendis ipsam. Et quod et earum adipisci eligendi modi ut. Quo fugit in molestiae eligendi et magni. Mollitia quas ratione dolores facere.,http://lorempixel.com/640/480/business,Sat Jul 11 2020 07:23:13 GMT-0600 (Mountain Daylight Time)
6,We need to compress the auxiliary RAM capacitor!,Veniam natus iusto. Necessitatibus id et dolorem adipisci non illo. Totam voluptas odio natus velit excepturi sed.,http://lorempixel.com/640/480/nightlife,Sat Jul 11 2020 16:36:20 GMT-0600 (Mountain Daylight Time)
5,Use the online ADP protocol, then you can override the mobile array!,Necessitatibus et sequi quia laboriosam repellat. Autem velit eos illum culpa ut rerum et. Doloremque dicta pariatur et est suscipit. Atque aut possimus eligendi cupiditate voluptatem autem.,http://lorempixel.com/640/480/fashion,Sat Jul 11 2020 13:00:47 GMT-0600 (Mountain Daylight Time)
9,Try to override the HDD firewall, maybe it will index the cross-platform driver!,Omnis in laborum eum expedita omnis id delectus quia. Sint voluptatem tempora qui adipisci ut. Qui eaque temporibus excepturi delectus ipsum ipsum. Possimus labore occaecati necessitatibus maiores aut quisquam voluptatem in. Vel a dolore voluptas est laudantium ipsa et molestiae et. Debitis maiores velit officiis numquam qui inventore ea quo animi.,http://lorempixel.com/640/480/technics,Sat Jul 11 2020 06:51:01 GMT-0600 (Mountain Daylight Time)
9,If we program the pixel, we can get to the SAS application through the back-end HDD panel!,Dolores sapiente nobis ut. Excepturi eius rem aut esse aperiam qui voluptatibus sunt quas. Adipisci nihil placeat quasi earum saepe tempore id cumque. Aspernatur expedita et in eos. Porro aspernatur accusantium quam voluptatem debitis commodi tempora. Illum dolor ullam voluptatem nam rerum.,http://lorempixel.com/640/480/technics,Fri Jul 10 2020 20:13:52 GMT-0600 (Mountain Daylight Time)
1,Try to connect the SDD port, maybe it will navigate the 1080p pixel!,Quia corrupti doloremque repellat. Et et necessitatibus nemo. Exercitationem similique assumenda labore consectetur est delectus qui vel.,http://lorempixel.com/640/480/cats,Sat Jul 11 2020 09:16:44 GMT-0600 (Mountain Daylight Time)
6,I'll compress the neural XSS monitor, that should bus the SMS bandwidth!,Ipsam quas quis. Illum qui officia blanditiis rerum vero id nesciunt et. Omnis occaecati eos delectus laborum velit dolorem laudantium. Recusandae deleniti saepe et cupiditate sunt tempora qui labore pariatur.,http://lorempixel.com/640/480/nature,Sat Jul 11 2020 11:58:32 GMT-0600 (Mountain Daylight Time)
6,You can't index the firewall without generating the multi-byte SSL card!,Tenetur iure laudantium. Recusandae aut aut aliquid temporibus ut voluptate itaque dicta. Laboriosam et est et hic sequi. Iste dicta voluptatem eum est aut quas omnis recusandae. Sint debitis exercitationem nostrum ullam expedita eum delectus sint. Modi totam distinctio iure veritatis et.,http://lorempixel.com/640/480/people,Sat Jul 11 2020 01:14:14 GMT-0600 (Mountain Daylight Time)
1,You can't generate the hard drive without parsing the open-source FTP program!,Magnam at et animi saepe animi nihil occaecati asperiores numquam. Architecto natus ut deserunt aspernatur fuga vitae. Voluptas consectetur quo quisquam laborum explicabo esse dolore.,http://lorempixel.com/640/480/people,Sat Jul 11 2020 10:08:17 GMT-0600 (Mountain Daylight Time)
0,I'll connect the digital COM protocol, that should matrix the SDD system!,Magni vero et eos. Aut dolorum vel tempore et consequatur. Laudantium rerum laudantium pariatur quisquam praesentium.,http://lorempixel.com/640/480/city,Sat Jul 11 2020 13:02:32 GMT-0600 (Mountain Daylight Time)
2,compressing the capacitor won't do anything, we need to generate the optical SSL feed!,Corporis magnam quisquam natus quae. Est in facilis omnis porro et. Dolorum laudantium mollitia reprehenderit soluta. Soluta aut explicabo laboriosam et repellendus cum. Praesentium omnis rerum dolores sint illum. Nostrum natus aliquam molestiae asperiores neque quaerat enim itaque iure.,http://lorempixel.com/640/480/technics,Sat Jul 11 2020 07:23:10 GMT-0600 (Mountain Daylight Time)
3,Try to synthesize the SAS matrix, maybe it will synthesize the haptic pixel!,At debitis aliquid commodi laborum. Necessitatibus qui aut explicabo. Eos sit voluptas qui ipsum minima. Dignissimos excepturi blanditiis omnis consectetur quo nemo dolorem autem sed.,http://lorempixel.com/640/480/transport,Sat Jul 11 2020 11:09:17 GMT-0600 (Mountain Daylight Time)
3,synthesizing the feed won't do anything, we need to quantify the digital COM sensor!,Iste veniam ut natus repellendus libero accusamus sunt dolorum facilis. Temporibus est nam nesciunt dolorem voluptas sit ipsa autem repudiandae. Fugit consectetur vel perspiciatis qui porro dignissimos est.,http://lorempixel.com/640/480/city,Sat Jul 11 2020 07:38:52 GMT-0600 (Mountain Daylight Time)
7,quantifying the capacitor won't do anything, we need to index the neural EXE transmitter!,Adipisci enim porro perspiciatis. Quibusdam qui eius debitis fugit fugiat vero aliquam molestiae. Aut in aspernatur eveniet et voluptatem ut ipsum quos non.,http://lorempixel.com/640/480/nature,Sat Jul 11 2020 10:16:30 GMT-0600 (Mountain Daylight Time)
2,The EXE hard drive is down, connect the multi-byte monitor so we can generate the CSS firewall!,Saepe doloribus minus velit omnis et et. Dolorem est perferendis nostrum sint rerum. Veniam molestiae quae voluptate.,http://lorempixel.com/640/480/animals,Sat Jul 11 2020 14:19:11 GMT-0600 (Mountain Daylight Time)
1,Use the solid state HDD hard drive, then you can transmit the primary panel!,Laboriosam repellat quis accusamus esse laboriosam. Provident velit laudantium nihil. Est quos adipisci dolor nihil. Sint consectetur iure quas eos cupiditate omnis autem. Aperiam quidem eum omnis ab. Consectetur eveniet quidem totam cupiditate quam minus qui.,http://lorempixel.com/640/480/abstract,Sat Jul 11 2020 07:34:17 GMT-0600 (Mountain Daylight Time)
4,If we parse the driver, we can get to the SAS panel through the back-end RAM pixel!,Molestiae repellendus in itaque cupiditate aut qui. Consequatur modi numquam minima quia id. Voluptate quo eaque.,http://lorempixel.com/640/480/sports,Fri Jul 10 2020 22:52:37 GMT-0600 (Mountain Daylight Time)
2,I'll input the solid state JBOD system, that should card the TCP bus!,Error nobis numquam nihil aut dolorem quidem vel. Qui et eum. Autem quis natus ipsam ducimus consequuntur qui doloremque. Possimus omnis aut minima.,http://lorempixel.com/640/480/sports,Sat Jul 11 2020 10:47:24 GMT-0600 (Mountain Daylight Time)
6,You can't input the interface without calculating the cross-platform AI panel!,Consectetur non ratione vel provident. Enim quis qui dolor praesentium. Beatae ea adipisci sed nihil minima soluta alias. Sed laboriosam ea cum. Quas repellendus quia. Qui nisi ut temporibus nam quia.,http://lorempixel.com/640/480/city,Sat Jul 11 2020 16:52:28 GMT-0600 (Mountain Daylight Time)
0,If we navigate the card, we can get to the FTP panel through the neural SMTP protocol!,Natus asperiores quod possimus quisquam asperiores natus consequatur. Inventore cum eaque quas expedita velit autem saepe reiciendis. Animi quis animi quia pariatur labore.,http://lorempixel.com/640/480/nature,Fri Jul 10 2020 22:51:31 GMT-0600 (Mountain Daylight Time)
3,I'll navigate the auxiliary COM driver, that should bus the EXE firewall!,Possimus ipsa est qui et. Ea blanditiis corrupti ut. Blanditiis doloribus qui. Modi molestias maiores blanditiis sed. Occaecati sint doloribus reiciendis ipsa magnam.,http://lorempixel.com/640/480/transport,Fri Jul 10 2020 19:54:04 GMT-0600 (Mountain Daylight Time)
3,Use the optical COM hard drive, then you can index the cross-platform system!,Ad corporis ut eveniet qui labore labore dolorem. Occaecati quo consequatur eos dolor. Dolorem eligendi autem voluptatem qui error cum eaque.,http://lorempixel.com/640/480/fashion,Sat Jul 11 2020 12:58:34 GMT-0600 (Mountain Daylight Time)
5,Use the multi-byte TCP bandwidth, then you can parse the virtual bandwidth!,Rem sit accusantium ut sequi. Consequatur eos ut sint sunt doloribus asperiores. Nemo beatae placeat fugit. Eos mollitia et numquam rem nulla eveniet in minima ea.,http://lorempixel.com/640/480/transport,Fri Jul 10 2020 18:26:09 GMT-0600 (Mountain Daylight Time)
8,The USB bandwidth is down, input the 1080p bandwidth so we can copy the FTP hard drive!,Labore molestias sit aut pariatur. Sunt at accusantium ut enim labore est iusto voluptatem. Sit autem culpa labore sed soluta deserunt a tempore.,http://lorempixel.com/640/480/technics,Fri Jul 10 2020 18:47:23 GMT-0600 (Mountain Daylight Time)
6,calculating the card won't do anything, we need to transmit the bluetooth XSS microchip!,Optio ut saepe excepturi rem aperiam dicta aperiam corrupti. Natus sunt doloribus natus eum quidem ab. Deserunt repudiandae omnis vel quia molestiae. Praesentium pariatur repellendus corrupti ex sequi libero repellendus.,http://lorempixel.com/640/480/city,Fri Jul 10 2020 18:50:29 GMT-0600 (Mountain Daylight Time)
2,The XSS card is down, navigate the virtual sensor so we can copy the USB microchip!,Ullam fuga in ad rerum repudiandae autem ut amet occaecati. Voluptas cumque eligendi fugiat aut tempora voluptatem natus non. Consequatur et quia veniam et. Architecto qui officiis nobis praesentium delectus. Necessitatibus error aspernatur dolorem alias incidunt.,http://lorempixel.com/640/480/people,Sat Jul 11 2020 06:43:25 GMT-0600 (Mountain Daylight Time)
8,I'll index the optical HDD bandwidth, that should pixel the CSS array!,Nesciunt aspernatur recusandae magnam ab. Ut itaque sed et assumenda itaque quisquam. Non qui excepturi aliquid laborum a sunt autem.,http://lorempixel.com/640/480/people,Sat Jul 11 2020 16:20:57 GMT-0600 (Mountain Daylight Time)
5,You can't connect the monitor without bypassing the back-end EXE protocol!,Ipsa quas beatae non odio quia occaecati est. Ullam exercitationem rerum quisquam. Quisquam pariatur ab aut voluptas qui dignissimos ex. Omnis officia consequatur ut omnis ex ad aut. Quis corrupti sunt. Impedit nam autem ipsa voluptatem non ut ab.,http://lorempixel.com/640/480/fashion,Sat Jul 11 2020 05:14:32 GMT-0600 (Mountain Daylight Time)
7,compressing the circuit won't do anything, we need to compress the auxiliary SSL application!,Quaerat eligendi mollitia eveniet alias. Unde iste ex et sed assumenda officiis. In minus praesentium iusto. Eveniet voluptatem vero iste.,http://lorempixel.com/640/480/business,Sat Jul 11 2020 10:31:18 GMT-0600 (Mountain Daylight Time)
6,I'll parse the multi-byte TCP circuit, that should microchip the FTP card!,Cupiditate quasi aut. Aspernatur voluptas et et quibusdam id. Ab veritatis quia aut omnis non tempore aperiam vitae. Culpa voluptas necessitatibus sit cum minus. Minima quae sint. Et quia aut autem provident laudantium aut.,http://lorempixel.com/640/480/abstract,Sat Jul 11 2020 07:29:23 GMT-0600 (Mountain Daylight Time)
1,I'll quantify the mobile COM matrix, that should microchip the RAM sensor!,Ut eum et rerum nihil magnam amet cumque. Deleniti saepe libero. Et quam voluptas autem et dolor voluptates et aut dolores. Doloribus officiis libero odit eveniet sed doloribus.,http://lorempixel.com/640/480/technics,Sat Jul 11 2020 16:51:04 GMT-0600 (Mountain Daylight Time)
3,Use the neural SAS driver, then you can synthesize the redundant microchip!,Reprehenderit aut accusantium eos. Distinctio in beatae minus quibusdam et suscipit ea dolorum. Ut et ut.,http://lorempixel.com/640/480/city,Sat Jul 11 2020 03:04:27 GMT-0600 (Mountain Daylight Time)
5,The SAS monitor is down, input the back-end feed so we can back up the JSON hard drive!,Quidem dolor neque autem. Voluptas est autem placeat accusamus dignissimos aut. Animi corrupti saepe.,http://lorempixel.com/640/480/nature,Sat Jul 11 2020 09:11:26 GMT-0600 (Mountain Daylight Time)
10,transmitting the transmitter won't do anything, we need to input the auxiliary SDD port!,Exercitationem repellat cumque inventore voluptate repudiandae nemo sed ex veritatis. Quod odit accusamus alias aspernatur. Quo repudiandae vel est quia veniam ea facilis libero quibusdam. Qui possimus modi veniam fugiat fugit ducimus dolores et aliquid. Qui ut cumque inventore necessitatibus dolorem quis architecto ducimus. Ab quam animi et voluptatum consequatur natus repellendus magni.,http://lorempixel.com/640/480/nature,Sat Jul 11 2020 09:29:34 GMT-0600 (Mountain Daylight Time)
9,I'll copy the cross-platform JSON port, that should transmitter the AI panel!,Ut quod et accusamus esse natus quos impedit perferendis dolor. Ut pariatur qui. Blanditiis commodi ut nihil explicabo voluptas quia non ut quaerat. Nemo non iusto. Dolorum exercitationem repellat voluptate placeat est.,http://lorempixel.com/640/480/animals,Sat Jul 11 2020 13:31:42 GMT-0600 (Mountain Daylight Time)
4,The HDD circuit is down, synthesize the redundant hard drive so we can transmit the PCI alarm!,Odit quia at debitis expedita. Nesciunt eaque deleniti dolore quo voluptas. Consequuntur ratione qui aperiam ipsum dolorem. Repellendus atque neque vel molestias molestiae. Sit sequi sit dolorum. Unde est quis sit distinctio ea impedit.,http://lorempixel.com/640/480/food,Fri Jul 10 2020 19:35:37 GMT-0600 (Mountain Daylight Time)
2,If we input the matrix, we can get to the PCI interface through the optical CSS pixel!,Soluta fuga aut eaque nulla suscipit iste totam aspernatur temporibus. Atque et et. Quia id officiis ipsam aspernatur nihil tempora.,http://lorempixel.com/640/480/technics,Sat Jul 11 2020 17:25:12 GMT-0600 (Mountain Daylight Time)
8,Use the virtual RAM bus, then you can program the open-source protocol!,Incidunt qui inventore soluta atque ad. Sunt commodi non asperiores qui id dicta. Suscipit aliquam ducimus adipisci incidunt hic.,http://lorempixel.com/640/480/city,Sat Jul 11 2020 15:13:33 GMT-0600 (Mountain Daylight Time)
0,If we generate the matrix, we can get to the SMTP monitor through the solid state COM hard drive!,Recusandae et dignissimos. In vel magni sed quas adipisci dolor maiores corrupti ut. Ut quia consequatur nulla ut voluptatibus aliquid sed. Molestiae non nemo est sit velit ab. In reiciendis vero mollitia ut architecto veritatis quod. Aut earum quos labore.,http://lorempixel.com/640/480/sports,Sat Jul 11 2020 01:17:12 GMT-0600 (Mountain Daylight Time)
5,I'll bypass the auxiliary PNG panel, that should system the TCP card!,Vero corrupti veniam. Temporibus quasi ipsam laudantium. In atque repellat eum explicabo a. Dicta veniam consequatur neque officiis cupiditate. Ullam ipsa corrupti reiciendis possimus molestiae ut. Velit ab commodi delectus voluptatibus.,http://lorempixel.com/640/480/business,Sat Jul 11 2020 08:57:19 GMT-0600 (Mountain Daylight Time)
6,You can't connect the firewall without programming the 1080p HTTP hard drive!,Saepe qui alias quia. Natus laboriosam totam voluptatem ipsa quae consequuntur est dolorem. Alias adipisci quasi quidem soluta voluptatem. Dolore aut dolor ut. Iure commodi saepe.,http://lorempixel.com/640/480/nightlife,Sat Jul 11 2020 18:13:55 GMT-0600 (Mountain Daylight Time)
